date,title,content,link,symbols
2026-05-27T12:38:10Z,Sony Stock Might Be One of the Deep‑Value Ways To Play AI,"It’s getting harder to find value within the AI scene these days, especially after the latest spike in the semiconductor stocks. With the iShares Semiconductor ETF (NASDAQ:SOXX) soaring more than 6% in a single day on Tuesday, it feels like the overheated names are just getting bubblier and bubblier. Of course, there’s still relative value ... Sony Stock Might Be One of the Deep‑Value Ways To Play AI",https://247wallst.com/investing/2026/05/27/sony-stock-might-be-one-of-the-deep%e2%80%91value-ways-to-play-ai/,['6758.T']
2026-05-26T17:07:58Z,GD Holdings buys 16 St. Regis Chicago condos from Sony for $21M,"Salomon Juan Marcos Villarreal Grupo Denim CEO and the St. Regis Chicago skyscraper at 363 E. Wacker Dr. (Getty, St. Regis Chicago)Denver-based GD Holdings is tightening its already formidable grip on the St. Regis Chicago, snapping up a portfolio of 16 luxury condominiums from Sony in a bulk deal valued at $21 million, public records show. The transaction, which breaks down to roughly $1.31 million per unit, underscores a recurring theme at the 101-story supertall: the power of the bulk discoun",https://finance.yahoo.com/markets/stocks/articles/gd-holdings-buys-16-st-170758609.html,['6758.T']
2026-05-26T02:06:31Z,Sony Denies PSN Crypto Rumors As Investors Weigh Valuation And Growth,"Sony Interactive Entertainment publicly denied rumors that PlayStation Network will integrate XRP or other third-party cryptocurrencies for payments or rewards. The clarification follows a period of online speculation that coincided with volatility in related crypto markets. Sony confirmed it is not adopting external crypto tokens on PSN at this time, while continuing to explore its own blockchain related initiatives. For investors watching Sony Group (TSE:6758), the statement draws a clear...",https://finance.yahoo.com/markets/stocks/articles/sony-denies-psn-crypto-rumors-020631242.html,['6758.T']
2026-05-25T23:11:00Z,Is Sony Group (TSE:6758) Pricing In Recent Entertainment And Gaming Momentum?,"If you are wondering whether Sony Group stock at ¥3,598 is giving you a fair deal or not, a clear look at its valuation can help you decide how it might fit into your portfolio. The share price return is flat over the past week at 0.1%, while the stock shows a 12.2% gain over 30 days, a decline of 11.8% year to date, a 1.6% return over 1 year, 45.0% over 3 years, and 80.6% over 5 years. Taken together, these figures give mixed signals about how the market has been reassessing the stock over...",https://finance.yahoo.com/markets/stocks/articles/sony-group-tse-6758-pricing-231100172.html,['6758.T']
2026-05-25T10:16:43Z,Sony Denies Ripple on PSN: What Does it Mean for XRP?,"In XRP news today, Sony Interactive Entertainment issued a formal statement in late May 2026 confirming that there are no plans to integrate XRP or any third-party cryptocurrency into the PlayStation Network for payments or rewards. The denial came after a rumor claiming an imminent Sony XRP partnership drove an ...",https://99bitcoins.com/news/altcoins/xrp-news-sony-denies-ripple-psn-technical-regulatory-blockers/,['6758.T']
2026-05-22T15:01:34Z,"Imax's Potential Acquirers Include Private Equity Firms, Netflix, Apple, Sony, Wedbush Says","Imax (IMAX) is an ""attractive"" asset, and its most likely acquirers include private equity firms, Ne",https://finance.yahoo.com/markets/stocks/articles/imax-apos-potential-acquirers-private-150134335.html,['6758.T']
2026-05-19T11:31:44Z,PlayStation Plus price hikes spark backlash from gamers as Sony raises subscription,Sony is increasing the price of PlayStation Plus memberships in several markets. The decision has prompted criticism from players who argue that subscription gaming is becoming increasingly expensive.View on euronews,https://www.euronews.com/2026/05/19/playstation-plus-price-hikes-spark-backlash-from-gamers-as-sony-raises-subscription?utm_source=yahoo&utm_campaign=feeds_business_articles_2024&utm_medium=referral,['6758.T']
2026-05-18T15:11:29Z,Sony Expands Music Catalog As AI And IP Strategy Takes Shape,"Sony Group (TSE:6758) is finalizing the acquisition of Recognition Music Group from Blackstone, adding a sizable catalog of music rights. The deal involves a partnership with GIC as Sony expands its presence in recorded and published music. The company has outlined a new long term plan centered on entertainment content, creation technology, IP, and artificial intelligence. Sony Group, through its music, gaming, film, and electronics businesses, sits at the crossroads of entertainment and...",https://finance.yahoo.com/sectors/technology/articles/sony-expands-music-catalog-ai-151129075.html,['6758.T']
2026-05-17T11:25:00Z,Japan's Stealth Bull Market: How U.S. Investors Can Get Exposure,"Japanese stocks continue to attract global investors as governance reform, shareholder returns, and a weak yen drive long-term upside",https://www.marketbeat.com/stock-ideas/japans-stealth-bull-market-how-us-investors-can-get-exposure/?utm_source=yahoofinance&utm_medium=yahoofinance,['6758.T']
2026-05-15T09:11:49Z,Sony Q4 Earnings Call Highlights,"Sony (NYSE:SONY) reported record annual sales and operating profit for fiscal 2025 while outlining a corporate strategy centered on entertainment, intellectual property, creation technology and artificial intelligence. Hiroki Totoki, Sony Group Corporation’s president and CEO, said the company had",https://www.marketbeat.com/instant-alerts/sony-q4-earnings-call-highlights-2026-05-15/?utm_source=yahoofinance&utm_medium=yahoofinance,['6758.T']
2026-05-14T20:40:50Z,Is Sony Group Corporation (SONY) A Good Stock To Buy Now?,"Is SONY a good stock to buy? We came across a bullish thesis on Sony Group Corporation on WinterGems: Industry Research’s Substack by @Govro12 WinterGems Stocks. In this article, we will summarize the bulls’ thesis on SONY. Sony Group Corporation’s share was trading at $20.73 as of May 6th. SONY’s trailing and forward P/E were 14.89 and […]",https://finance.yahoo.com/markets/stocks/articles/sony-group-corporation-sony-good-204050928.html,['6758.T']
2026-05-14T17:36:16Z,Is Sony Group Corporation (SONY) Among the Best Hardware Stocks to Buy for the AI PC Revolution?,"With an upside potential of 55.43%, Sony Group Corporation (NYSE:SONY) is among the 7 Best Hardware Stocks to Buy for the AI PC Revolution. On May 10, BofA raised the firm’s price target on Sony Group Corporation (NYSE:SONY) from $30.67 to $34 and maintains a Buy rating on the shares. According to the analyst’s research note for […]",https://finance.yahoo.com/markets/stocks/articles/sony-group-corporation-sony-among-173616390.html,['6758.T']
2026-05-13T17:09:11Z,Sony Music Publishing Lands Iconic Song Catalog In Major Blackstone Deal,"Sony Group Corporation (NYSE:SONY) shares traded higher Wednesday as investors reacted to a major music catalog acquisition by the company's publishing arm and continued buying into large-cap growth and entertainment stocks. The Nasdaq gained 0.90%, while the S&P 500 advanced 0.49%, supporting broader momentum across tech-linked names. Sony Expands Music Catalog Portfolio Sony Music Publishing, the publishing arm of Sony Music Group and one of the world's largest music publishers, agreed to acqu",https://finance.yahoo.com/news/sony-music-publishing-lands-iconic-170911527.html,['6758.T']
2026-05-13T16:05:02Z,Sony Stock Eyes Recovery as the Technical Setup Firms,"Sony Group (SONY) shares have begun to stabilize, trading north of $22 as short-term technicals point toward a burgeoning recovery phase. The stock recently generated a Trend Seeker “BUY” rating, which makes SONY a technical turnaround candidate. Sony’s price action is now testing the $20.85 level, its 20-day moving average,...",https://www.barchart.com/story/news/1909032/sony-stock-eyes-recovery-as-the-technical-setup-firms,['6758.T']
2026-05-13T14:00:00Z,Sony Electronics Accelerates High-Resolution Photography with the Alpha 7R VI,"Sony Electronics introduces the Alpha 7R VI, the sixth generation of its celebrated Alpha 7R series. Built on the series' legacy of leading resolution, this full-frame mirrorless camera pairs an approximately 66.8 effective megapixel back-illuminated fully-stacked Exmor RS™ CMOS sensor with the new BIONZ XR2™ engine. The result: exceptional resolution, accurate color, and reliable performance across subjects ranging from people in motion to wildlife to expansive landscapes.",https://finance.yahoo.com/news/sony-electronics-accelerates-high-resolution-140000376.html,['6758.T']
2026-05-13T13:15:58Z,Sony Group (SONY): The Best Affordable Stock to Buy According to Wall Street Analysts,"Sony Group Corporation (NYSE:SONY) is one of the 10 Best Affordable Stocks to Buy According to Wall Street Analysts. On May 11, 2026, Benchmark analyst Mike Hickey lowered the firm’s price target on Sony Group Corporation (NYSE:SONY) to 3,900 yen from 4,250 yen while maintaining a Buy rating following what the firm described as a […]",https://finance.yahoo.com/news/sony-group-sony-best-affordable-131558761.html,['6758.T']
2026-05-13T13:15:00Z,TCL Electronics (01070.HK) Maintains Strong Growth in Q1 2026,"TCL Electronics Holdings Limited (""TCL Electronics"" or the ""Company"", 01070.HK) today announced its unaudited results for the first quarter ended 31 March 2026. In the first quarter of 2026, the Company firmly advanced its strategies of ""Globalisation"" and ""Mid-to-High-End Positioning"", enhanced product competitiveness, reduced costs and improved efficiency, driving its core business to achieve quality growth. In the first quarter, the Company recorded revenue of HK$29.2 billion, representing a",https://finance.yahoo.com/news/tcl-electronics-01070-hk-maintains-131500752.html,['6758.T']
2026-05-13T12:30:03Z,Here's How Much a $1000 Investment in Sony Made 10 Years Ago Would Be Worth Today,"Investing in certain stocks can pay off in the long run, especially if you hold on for a decade or more.",https://finance.yahoo.com/news/heres-much-1000-investment-sony-123003988.html,['6758.T']
2026-05-13T12:17:32Z,A Look At Sony Group (TSE:6758) Valuation As Shares Rebound Despite Year To Date Decline,"Why Sony Group Stock Is On Investors’ Radar Today Sony Group (TSE:6758) is drawing renewed attention after a recent stretch of mixed share performance, with gains over the past month and past 3 months set against a decline year to date. See our latest analysis for Sony Group. The recent 1 day share price return of 5.63% and 7 day share price return of 17.68% contrast with a year to date share price decline of 9.78%. At the same time, the 3 year total shareholder return of 52.62% points to...",https://finance.yahoo.com/news/look-sony-group-tse-6758-121732206.html,['6758.T']
2026-05-12T23:45:35Z,Here's How Much You Would Have Made Owning Sony Group Stock In The Last 10 Years,"Sony Group (NYSE:SONY) has outperformed the market over the past 10 years by 2.33% on an annualized basis producing an average annual return of 16.01%. Currently, Sony Group has a market capitalization of $131.57 billion. Buying $1000 In SONY: If an investor had bought $1000 of SONY stock 10 years ago, it would be worth $4,341.85 today based on a price of $22.27 for SONY at the time of writing. Sony Group's Performance Over Last 10 Years Finally -- what's the point of all this? The key insight t",https://finance.yahoo.com/news/heres-much-made-owning-sony-234535422.html,['6758.T']
2026-05-12T20:28:00Z,"Top Stock Reports for NVIDIA, Mastercard & AbbVie","NVIDIA, Mastercard and AbbVie headline Zacks' top stock reports, with AI growth, payment trends and drug launches in focus.",https://finance.yahoo.com/news/top-stock-reports-nvidia-mastercard-202800878.html,['6758.T']
2026-05-12T13:55:03Z,Wall Street Analysts Think Sony (SONY) Could Surge 39.74%: Read This Before Placing a Bet,"The consensus price target hints at a 39.7% upside potential for Sony (SONY). While empirical research shows that this sought-after metric is hardly effective, an upward trend in earnings estimate revisions could mean that the stock will witness an upside in the near term.",https://finance.yahoo.com/markets/stocks/articles/wall-street-analysts-think-sony-135503235.html,['6758.T']
2026-05-08T18:34:00Z,Nintendo Raising Switch 2 Prices. The Memory Hits Keep Coming.,"Nintendo  just announced price increases as memory costs continue to pose a problem for tech hardware companies.  Nintendo  said on Friday that due to “changes in market conditions,” the videogame company is raising retail prices of the Nintendo Switch 2.  Nintendo is also raising the price for the Switch 2 in Canada, Europe, and Japan.",https://www.barrons.com/articles/nintendo-switch-prices-memory-stock-5bbafb86?siteid=yhoof2&yptr=yahoo,['6758.T']
2026-05-08T14:16:00Z,"SONY's Q4 Earnings Plunge Y/Y Despite Healthy Revenues, G&NS Weakens","Sony Q4 FY2025 revenues jump 8% to 3,036.4B yen, but GAAP EPS fall to 13.93 yen as gaming and ""All Other"" weighed on results.",https://finance.yahoo.com/markets/stocks/articles/sonys-q4-earnings-plunge-y-141600175.html,['6758.T']
2026-05-08T14:00:00Z,NXST Q1 Earnings Beat Estimates on TEGNA Deal and Political Lift,"Nexstar tops Q1 estimates as TEGNA deal boosts revenues and political ads surge, while The CW moves closer to profitability in 2026.",https://finance.yahoo.com/markets/stocks/articles/nxst-q1-earnings-beat-estimates-140000112.html,['6758.T']
2026-05-08T13:52:00Z,"NWSA's Q3 Earnings Surpass Estimates, Revenues Increase Y/Y","News Corporation posts fiscal Q3 earnings and revenue growth, fueled by gains in Dow Jones, digital real estate and book publishing.",https://finance.yahoo.com/markets/stocks/articles/nwsas-q3-earnings-surpass-estimates-135200229.html,['6758.T']
2026-05-08T13:19:25Z,Sony and TSMC form joint venture for image sensors in Japan,"The majority Sony-owned venture will set up production lines in Kumamoto Prefecture, with potential Japanese government backing",https://qz.com/sony-tsmc-joint-venture-image-sensors-japan-050826,['6758.T']
2026-05-08T12:11:11Z,"Sony FY2025 earnings: profit forecast, PS5 sales, share buyback",The Japanese entertainment company expects net profit to rise 13% to ¥1.16 trillion and announced a ¥500 billion share buyback,https://qz.com/sony-fy2025-earnings-profit-forecast-playstation-music-image-sensors-050826,['6758.T']
2026-05-08T10:52:13Z,Sony forecasts lower gaming business sales amid memory price surge,"<body><p>STORY: Sony forecast lower sales in its gaming business due to a memory chip price surge.</p><p>The tech giant said Friday annual sales in the segment would fall 6% to $28 billion.</p><p>It also blamed lower hardware sales as its PlayStation 5 ages.</p><p>Although the Japanese company said it expects gaming profit to rise 30%.</p><p>That's due to higher first-party software sales and no repeat of the impairment loss it recorded a year earlier.</p><p>Sony has been praised by analysts in recent years for its transformation into an entertainment powerhouse.</p><p>But markets have grown concerned about the impact of AI on its business, while Sony also faces a perceived lack of growth catalysts.</p><p>Both factors have weighed on shares in recent months.</p><p>Investors are also concerned about the impact of a memory-chip price surge.</p><p>As well as disruption to supply chains from the Iran war on margins at electronics manufacturers.</p><p>The firm said it sold 1.5 million PS5 consoles in the fourth quarter, which was&nbsp;a 46% drop on the same period a year earlier.</p><p>Looking ahead, the PS5 is expected to receive a major boost from the launch of the delayed ""Grand Theft Auto VI.""</p><p>The game is due to release in November.</p><p>Sony said in February it had secured the minimum quantity of memory needed to manage the year-end shopping season.&nbsp;</p><p>Sony also said it sees higher profits at its pictures and chips units but a lower profit at its music business.</p><p>The group reported operating profit for the year ended March rose 13.4% to $9.2 billion - below analyst forecasts.&nbsp;</p><p>Meanwhile, rival Nintendo said it expects to sell 16.5 million units of its Switch 2 console in the financial year ending March 2027.</p><p>It also projects profit to rise 2.7% to $2.36 billion.</p><p>But, like with Sony, investors are concerned about the possible&nbsp;impact of a memory price surge on margins.</p></body>",https://finance.yahoo.com/video/sony-forecasts-lower-gaming-business-105213948.html,['6758.T']
2026-05-08T10:18:02Z,"Sony, Nintendo grapple with memory price surge as AI boom constrains supply","Nintendo and Sony both flagged the impact from surging memory prices on their games businesses on Friday, as the artificial intelligence boom constrains chip supply and deepens disruptions across the ‌tech sector.  ""Super Mario"" maker Nintendo said that higher component costs, particularly memory, and the impact of tariffs is expected to add roughly 100 billion yen ($638 million) to costs in the current financial year.  ""The very fact that Nintendo felt compelled to act (price increase) suggests the rise in memory costs has become severe enough that it could no longer be absorbed internally - and, crucially, that there is little prospect of those cost pressures easing in the near ‌term,"" Morningstar analyst Kazunori Ito said.",https://finance.yahoo.com/sectors/technology/articles/sony-nintendo-grapple-memory-price-101802900.html,['6758.T']
2026-05-08T08:51:41Z,"Update: Sony Fiscal Q4 Net Income Falls, Revenue Increases; Fiscal 2026 Sales Guidance Issued",(Updates with details of share buyback scheme in the ninth paragraph.) Sony (SONY) reported fisca,https://finance.yahoo.com/markets/stocks/articles/sony-fiscal-q4-net-income-085141094.html,['6758.T']
2026-05-08T08:38:34Z,"Sony, TSMC plan new Japan joint venture for next-generation image sensors","Taiwan Semiconductor Manufacturing Co and Sony Semiconductor Solutions said on Friday ‌they plan to form a new joint venture ‌in Japan to develop and manufacture next-generation image sensors.  The venture will combine ​Sony’s sensor design expertise with TSMC’s manufacturing and process technology strengths, deepening a long-standing partnership of the two companies.  It will be majority-owned by Sony, and will set up development and ‌production lines in ⁠the Japanese company's new fabrication plant in Koshi City in the Kumamoto region.",https://finance.yahoo.com/sectors/technology/articles/sony-tsmc-plan-japan-joint-083834976.html,['6758.T']
2026-05-08T08:02:36Z,"Sony Fiscal Fiscal Q4 Net Income Falls, Revenue Increases; Fiscal 2026 Sales Guidance Issued","Sony (SONY) reported fiscal Q4 net income Friday of 13.93 Japanese yen ($0.09) per diluted share, do",https://finance.yahoo.com/markets/stocks/articles/sony-fiscal-fiscal-q4-net-080236194.html,['6758.T']
2026-05-08T05:27:46Z,Japan's Sony reports declining profit but expects a record for this year,"Japanese electronics and entertainment giant Sony Group Corp. reported a 3.4% drop in its annual profit but projected Friday a comeback to record profits for the current fiscal year.  Tokyo-based Sony’s net profit for the year through March totaled 1.03 trillion yen ($6.6 billion), down from 1.07 trillion yen in the previous fiscal year.  Rising costs of computer chips also bit into profit and remain a concern, according to Sony, which has film, music and video-game operations.",https://finance.yahoo.com/markets/stocks/articles/japans-sony-reports-declining-profit-052746110.html,['6758.T']
2026-05-08T00:28:38Z,Is Sony Group (TSE:6758) Fairly Priced After This Year’s 23% Share Price Slide?,"If you are wondering whether Sony Group's share price still reflects what the business might be worth, or if the stock is starting to look mispriced, this breakdown is designed to help you frame that question clearly. Sony Group's stock recently closed at ¥3,130, with returns of 0.5% over 7 days, a 5.5% decline over 30 days, a 23.3% decline year to date, and gains of 33.3% over 3 years and 69.6% over 5 years. Recent headlines have focused on Sony Group's position in consumer electronics,...",https://finance.yahoo.com/markets/stocks/articles/sony-group-tse-6758-fairly-002838662.html,['6758.T']
2026-05-07T21:50:02Z,Sony (SONY) Sees a More Significant Dip Than Broader Market: Some Facts to Know,"Sony (SONY) concluded the recent trading session at $19.89, signifying a -4.05% move from its prior day's close.",https://finance.yahoo.com/markets/stocks/articles/sony-sony-sees-more-significant-215002014.html,['6758.T']
2026-05-07T13:40:00Z,"Warner Bros. Discovery Q1 Earnings Miss Estimates, Revenues Fall Y/Y","WBD's Q1 loss widens on merger and restructuring costs, even as streaming subscribers topped 140M and Studios revenue surged.",https://finance.yahoo.com/markets/stocks/articles/warner-bros-discovery-q1-earnings-134000162.html,['6758.T']
2026-05-06T19:47:11Z,Sector Update: Consumer Stocks Rise Late Afternoon,"Consumer stocks were higher late Wednesday afternoon, with the State Street Consumer Staples Select",https://finance.yahoo.com/markets/stocks/articles/sector-consumer-stocks-rise-afternoon-194711681.html,['6758.T']
2026-05-06T17:43:04Z,Sector Update: Consumer Stocks Mixed in Afternoon Trading,"Consumer stocks were mixed Wednesday afternoon, with the State Street Consumer Staples Select Sector",https://finance.yahoo.com/markets/stocks/articles/sector-consumer-stocks-mixed-afternoon-174304886.html,['6758.T']
2026-05-06T14:42:00Z,"Disney Q2 Earnings Surpass Estimates, Revenues Increase Y/Y","DIS posts higher fiscal Q2 revenues and adjusted EPS, boosted by streaming gains, parks growth and stronger SVOD profitability.",https://finance.yahoo.com/markets/stocks/articles/disney-q2-earnings-surpass-estimates-144200154.html,['6758.T']
2026-05-06T10:30:00Z,PlayStation users could get paid from a $7.85 million settlement. Here’s who qualifies,"Millions are included automatically, but the fine print will decide who gets what.",https://www.fastcompany.com/91537152/playstation-users-could-get-paid-from-a-7-85-million-settlement-heres-who-qualifies,['6758.T']
2026-05-05T13:46:00Z,"PSKY Q1 Earnings & Revenues Beat Estimates, Q2 Outlook Soft","Paramount Skydance tops Q1 estimates on streaming strength and studio rebound, but signals a softer Q2 as tough comps and subscriber exits temper near-term growth.",https://finance.yahoo.com/markets/stocks/articles/psky-q1-earnings-revenues-beat-134600464.html,['6758.T']
2026-05-05T13:30:06Z,Wall Street Analysts Think Sony (SONY) Is a Good Investment: Is It?,"Based on the average brokerage recommendation (ABR), Sony (SONY) should be added to one's portfolio. Wall Street analysts' overly optimistic recommendations cast doubt on the effectiveness of this highly sought-after metric. So, is the stock worth buying?",https://finance.yahoo.com/markets/stocks/articles/wall-street-analysts-think-sony-133006972.html,['6758.T']
2026-05-05T10:11:43Z,Is Sony’s Scrapped Afeela EV Refocusing Its Auto Strategy On Software And AI? (TSE:6758),"In recent days, Sony Group Corp and Honda Motor Co. confirmed they have cancelled development of their jointly built Afeela 1 electric vehicle, created under their 50-50 mobility venture. Instead of producing the car, the partners plan to reuse Afeela 1 technologies, such as its AI assistant and audio systems, across new non-EV products and services, potentially broadening Sony’s role in software- and content-led automotive experiences. We’ll now examine how this pivot toward repurposing...",https://finance.yahoo.com/sectors/technology/articles/sony-scrapped-afeela-ev-refocusing-101143565.html,['6758.T']
2026-05-04T15:14:00Z,"ROKU Shares Rise 6% on Q1 Earnings Beat, Revenues and EPS Up Y/Y","Roku stock jumps after Q1 earnings beat estimates, with platform revenue surging and free cash flow hitting a record high on strong ad and subscription growth.",https://finance.yahoo.com/markets/stocks/articles/roku-shares-rise-6-q1-151400825.html,['6758.T']
2026-05-04T14:59:00Z,"IMAX Shares Decline 4% Despite Q1 Earnings Beat, Revenues Down Y/Y","IMAX tops Q1 earnings estimates, but revenue declines and margin pressure tied to China headwinds weigh on shares despite strong global performance.",https://finance.yahoo.com/markets/stocks/articles/imax-shares-decline-4-despite-145900264.html,['6758.T']
2026-05-02T18:30:45Z,What’s Next For Sony Group Corp (SONY) and Honda Motor As Morgan Stanley Touts $22B Opportunity?,"Sony Group Corp (NYSE:SONY) is one of the best Japanese stocks to buy right now. On April 17, Reuters reported that Sony Group Corp (NYSE:SONY) and its strategic partner, Honda Motor, are poised to pursue other opportunities as part of their 50-50 joint venture. The push comes weeks after the two canceled the development of […]",https://finance.yahoo.com/markets/stocks/articles/next-sony-group-corp-sony-183045104.html,['6758.T']
2026-04-30T21:50:04Z,Sony (SONY) Laps the Stock Market: Here's Why,"In the most recent trading session, Sony (SONY) closed at $20.09, indicating a +1.57% shift from the previous trading day.",https://finance.yahoo.com/markets/stocks/articles/sony-sony-laps-stock-market-215004058.html,['6758.T']
2026-04-30T16:45:31Z,"InterDigital, Inc. Q1 2026 Earnings Call Summary","Moby summary of InterDigital, Inc.'s Q1 2026 earnings call",https://app.moby.co/home/research/tools/earningsCalendar/earnings-interdigital-inc-q1-2026-earnings-call-summary?utm_source=yahoo_finance&utm_medium=rss,['6758.T']
