date,title,content,link,symbols
2026-07-08T00:00:00Z,Anaqua Renews Partnership with Sony to Advance IP Innovation,"TOKYO, July 07, 2026 (GLOBE NEWSWIRE) -- Anaqua, the leading provider of innovation and intellectual property (IP) management technology solutions and services, today announced the renewal of its partnership with Sony Group Corporation (""Sony""). Under this agreement, Anaqua will support Sony in strengthening intellectual property as a core driver of its business strategy, innovation, and global growth. Anaqua was first selected by Sony as its IP management platform in 2018. The renewal of this p",https://finance.yahoo.com/technology/ai/articles/anaqua-renews-partnership-sony-advance-000000853.html,['6758.T']
2026-07-07T16:16:30Z,"Behind Xbox’s Big Layoffs, a Streaming Strategy That Failed","(Bloomberg) -- Microsoft Corp.’s Xbox spent nearly $80 billion in the last decade on deals that would give it popular video game titles like Call of Duty and Skyrim, betting that gamers would flock to its Netflix-like subscription service offering hundreds of options for endless play.Most Read from BloombergGreece Offers Bounty to Catch Ravenous Fish Lured by Warming SeaTwo Millennium Trading Pods Made About $3.7 Billion Last MonthNasdaq 100 Falls 2% in Chip-Led Rout as Oil Climbs: Markets WrapM",https://finance.yahoo.com/media-advertising/articles/behind-xbox-big-layoffs-streaming-161630786.html,['6758.T']
2026-07-07T14:19:32Z,"How to Anger 166,000 Fans and Please Wall Street in One Post: Ask Sony","Sony stock climbs 8.6% while the PlayStation disc backlash tops 165,000 signatures and eight Community Notes challenge its data.",https://beincrypto.com/sony-stock-playstation-disc-backlash/,['6758.T']
2026-07-06T13:31:51Z,"Microsoft’s Xbox to Cut 3,200 Jobs, Divest Five Studios in Major Overhaul","(Bloomberg) -- Microsoft Corp.’s Xbox plans to eliminate 3,200 jobs, or around 20% of its staff over the next year, as part of a massive reorganization to spur growth in the struggling gaming division. Xbox will also divest four of its video-game development studios and is beginning the process to part ways with a fifth.Most Read from BloombergGreece Offers Bounty to Catch Ravenous Fish Lured by Warming SeaOil, Gas Tankers Cross Hormuz Via Oman-Side Route After U-TurnsThe Tanker Tycoon Making Mi",https://finance.yahoo.com/technology/articles/microsoft-xbox-cut-3-200-133151615.html,['6758.T']
2026-07-03T11:11:49Z,Sony Group (TSE:6758) Is Up 5.6% After Committing To Digital-Only PlayStation Games From 2028,"In recent weeks, Sony Group completed a ¥127,476.79 million buyback of 37,076,600 shares and outlined board, debt, and equity plans, while also confirming a full shift to digital-only PlayStation game distribution from January 2028 and the staged closure of PS3 and PS Vita online stores. This package of capital allocation moves and the end of new physical game discs underscores Sony’s push toward higher-margin digital ecosystems and recurring software revenue. We’ll now examine how Sony’s...",https://finance.yahoo.com/markets/stocks/articles/sony-group-tse-6758-5-111149358.html,['6758.T']
2026-07-02T22:13:33Z,Here’s Why Sony Group (SONY) is One of the Cheap Stocks That Are About to Explode,"Sony Group Corporation (NYSE:SONY) is one of the cheap stocks that are about to explode. On June 23, Sony announced plans to return to the US investment-grade bond market for the first time since 1998. The company mandated Bank of America and Morgan Stanley to initiate investor calls for a two-tranche offering featuring 5-year and […]",https://finance.yahoo.com/markets/stocks/articles/why-sony-group-sony-one-221431788.html,['6758.T']
2026-07-02T22:00:06Z,Sony (SONY) Stock Moves 2.87%: What You Should Know,"The latest trading day saw Sony (SONY) settling at $20.79, representing a +2.87% change from its previous close.",https://finance.yahoo.com/markets/stocks/articles/sony-sony-stock-moves-2-220006143.html,['6758.T']
2026-07-02T16:23:00Z,Is the Clock Ticking on GameStop Stock?,"Sony is moving on from physical game discs soon, and that's a bigger deal than you might think.",https://www.fool.com/investing/2026/07/02/is-the-clock-ticking-on-gamestop-stock/,['6758.T']
2026-07-02T13:52:59Z,Sony Ends PlayStation Discs in 2028 as Digital Shift Accelerates,"Sony will stop PlayStation disc production in January 2028, pushing future console games fully through its online storefront.",https://finance.yahoo.com/media-advertising/articles/sony-ends-playstation-discs-2028-135259384.html,['6758.T']
2026-07-02T09:42:20Z,Sony Will Stop Making Discs for New PlayStation Games in January 2028,"Sony will stop making physical game discs in January 2028, and Xbox's Project Helix reportedly drops its disc drive too.",https://beincrypto.com/sony-physical-game-discs-xbox-digital/,['6758.T']
2026-07-01T20:15:00Z,Sony to cease physical PlayStation disc production in 2028,"Yahoo Finance Tech Editor Dan Howley breaks down some of the day's biggest headlines, including Sony (SONY) announcing that it will cease production of physical discs for PlayStation console games in 2028.",https://finance.yahoo.com/video/sony-cease-physical-playstation-disc-201500457.html,['6758.T']
2026-07-01T14:16:32Z,Sony to end physical PlayStation game disc production in 2028,"Sony will stop producing physical discs for all new PlayStation games beginning in 2028, as the company embraces an all-digital future.",https://finance.yahoo.com/media-advertising/articles/sony-end-physical-playstation-game-141632008.html,['6758.T']
2026-07-01T14:13:28Z,Sony to end PlayStation disc production in January 2028,"Investing.com -- Sony Interactive Entertainment dealt the physical gaming market a landmark blow on Wednesday, announcing that disc production for all new PlayStation games will cease in January 2028, a watershed moment for console gaming. The company's own data shows that nearly four in five full-game purchases on PS4 and PS5 were made digitally over the past year, providing the commercial rationale for a policy that applies to every publisher, not just Sony's first-party titles.",https://finance.yahoo.com/media-advertising/articles/sony-end-playstation-disc-production-141328232.html,['6758.T']
2026-07-01T13:52:47Z,Sony to end discs for new PlayStation releases as gaming shifts online,"Sony said on Wednesday it will stop producing physical discs for all new games ‌released on PlayStation consoles from January 2028, marking a full ‌shift to digital distribution as consumer purchases continue to move online.  Digital downloads accounted for ​about 80% of Sony's full-game software sales in fiscal 2025, according to the company, reflecting a years-long shift toward digital game purchases.  The Japanese entertainment and technology company said new PlayStation titles released from January 2028 ‌will be sold through ⁠the PlayStation Store and by retailers in digital formats only.",https://finance.yahoo.com/technology/articles/sony-end-discs-playstation-releases-135247313.html,['6758.T']
2026-07-01T13:34:02Z,Sony to End Production of Physical PlayStation Discs in 2028,"(Bloomberg) -- Sony Group Corp. will end production of physical discs for its PlayStation video-game consoles starting in January 2028, going all in on a digital approach that will require consumers to download titles from the company’s online storefront moving forward.Most Read from BloombergSpaceX IPO Left Mirae With No Shares on MisunderstandingTrump Reports at Least $1.4 Billion in 2025 Crypto EarningsSupreme Court Backs Birthright Citizenship in Blow to TrumpDemocratic Socialist Ousts 15-Te",https://finance.yahoo.com/media-advertising/articles/sony-end-production-physical-playstation-133402506.html,['6758.T']
2026-07-01T09:41:13Z,"Market Chatter: Japan to Back Honda, Sony and SoftBank-Led AI Consortium With Up to $6.1 Billion","Honda Motor (HMC), Sony (SONY), NEC and SoftBank are part of a consortium that will receive up to 1",https://finance.yahoo.com/technology/ai/articles/market-chatter-japan-back-honda-094113937.html,['6758.T']
2026-07-01T00:37:00Z,Sony isn't sugarcoating PlayStation 6 warning as console costs rise,"At the start of every console cycle, we ask the same question: How much better will the next system be? For Sony, the next cycle could bring a tougher question. How much more will gamers be prepared to pay? The PlayStation 5 remains one of the most vital platforms in gaming, but the console ...",https://www.thestreet.com/entertainment/sony-playstation-6-warning-console-costs-rise,['6758.T']
2026-06-30T10:16:00Z,LiveOne (LVO) Moves 7.1% Higher: Will This Strength Last?,LiveOne (LVO) was a big mover last session on higher-than-average trading volume. The latest trend in earnings estimate revisions might help the stock continue moving higher in the near term.,https://finance.yahoo.com/markets/stocks/articles/liveone-lvo-moves-7-1-101600423.html,['6758.T']
2026-06-27T19:00:00Z,Tech Equity Sales Renew AI Debt-Binge Worries,"(Bloomberg) -- Tech companies are selling stock like it’s the dot-com boom, and some investors fear that’s a bad sign for bondholders.Most Read from BloombergLutnick Delayed Canada Bridge Debut to Seek Bigger Cut of Toll RevenueOman Tells Allies Ships Going Through Hormuz May Have to PayIndonesia Opens Door to Dirty Money to Fund Prabowo’s PlansAn Analyst’s Missed Remark Surfaced in Deadly Iran School Strike ProbeApple Shares Sink After Price Hikes Hit iPads and MacsThis month alone, there’s bee",https://finance.yahoo.com/markets/stocks/articles/tech-equity-sales-renew-ai-190000255.html,['6758.T']
2026-06-26T21:50:05Z,Sony (SONY) Rises As Market Takes a Dip: Key Facts,"The latest trading day saw Sony (SONY) settling at $19.71, representing a +2.02% change from its previous close.",https://finance.yahoo.com/markets/stocks/articles/sony-sony-rises-market-takes-215005113.html,['6758.T']
2026-06-25T17:16:06Z,Microsoft Raises Xbox Console Prices for Third Time in 13 Months,(Bloomberg) -- Microsoft Corp. announced a third substantial price increase for the company’s current-generation Xbox video-game consoles in a glaring example of the component shortage crisis that has universally driven up the cost of consumer tech products.Most Read from BloombergInvestor Who Scored 900% Win in 2008 Crisis Has New Big Short BetStocks Whipsaw as Micron Surges While Apple Sinks: Markets WrapGrand Ole Opry House Up For Sale by Owner Ryman HospitalityMicron Shares Soar After AI-Fue,https://finance.yahoo.com/technology/articles/microsoft-raises-xbox-console-prices-171606076.html,['6758.T']
2026-06-24T21:11:27Z,Sony (TSE:6758) Returns To The US Dollar Bond Market After Nearly 30 Years,"Sony Group (TSE:6758) has issued senior unsecured US dollar bonds, returning to the US dollar bond market nearly three decades after its last sale. The company completed multiple USD denominated fixed income offerings as part of this transaction. The bonds are investment grade, supported by Sony Group's current credit ratings. Sony Group (TSE:6758) is a diversified business with positions across gaming, entertainment, imaging, and electronics, so its funding decisions attract wide attention...",https://finance.yahoo.com/markets/stocks/articles/sony-tse-6758-returns-us-211127757.html,['6758.T']
2026-06-24T13:00:04Z,Is Most-Watched Stock Sony Corporation (SONY) Worth Betting on Now?,"Zacks.com users have recently been watching Sony (SONY) quite a bit. Thus, it is worth knowing the facts that could determine the stock's prospects.",https://finance.yahoo.com/markets/stocks/articles/most-watched-stock-sony-corporation-130004611.html,['6758.T']
2026-06-24T05:08:35Z,Sony Group (TSE:6758) Stock Price Slide Raises Questions After DCF And P/E Valuation Checks,"If you are wondering whether Sony Group stock offers fair value at today's price, this article sets out to unpack what that current market tag really reflects. The stock closed at ¥3,177, with the share price down 3.0% over the past week, 9.9% over the past month, and 22.1% year to date. It is still showing a 6.4% decline over one year, compared with longer term gains of 32.4% over three years and 56.4% over five years. Recent coverage around Sony Group has focused on its position as a...",https://finance.yahoo.com/markets/stocks/articles/sony-group-tse-6758-stock-050835230.html,['6758.T']
2026-06-23T13:30:10Z,Wall Street Bulls Look Optimistic About Sony (SONY): Should You Buy?,"Based on the average brokerage recommendation (ABR), Sony (SONY) should be added to one's portfolio. Wall Street analysts' overly optimistic recommendations cast doubt on the effectiveness of this highly sought-after metric. So, is the stock worth buying?",https://finance.yahoo.com/markets/stocks/articles/wall-street-bulls-look-optimistic-133010932.html,['6758.T']
2026-06-23T12:32:11Z,Sony Returns to US Bond Market With New 5-Year and 10-Year Notes,The company is marketing investment-grade dollar bonds as tight credit spreads drive strong issuance activity.,https://finance.yahoo.com/markets/stocks/articles/sony-returns-us-bond-market-123211076.html,['6758.T']
2026-06-23T10:10:46Z,Market Chatter: Japanese Corporations Making Beeline for Global Bond Sales,"Sony Group (SONY), Nomura Holdings, and the finance unit of Japanese telecom giant NTT are planning",https://finance.yahoo.com/markets/currencies/articles/market-chatter-japanese-corporations-making-101046383.html,['6758.T']
2026-06-22T22:00:06Z,Sony (SONY) Registers a Bigger Fall Than the Market: Important Facts to Note,"In the most recent trading session, Sony (SONY) closed at $19.51, indicating a -4.03% shift from the previous trading day.",https://finance.yahoo.com/markets/stocks/articles/sony-sony-registers-bigger-fall-220006587.html,['6758.T']
2026-06-22T20:10:03Z,Sony Plans Its First Dollar-Bond Sale in Nearly Three Decades,"(Bloomberg) -- Sony Group Corp. was still marketing the original PlayStation when it last tapped the US investment-grade bond market. Almost three decades later, it’s readying a comeback. Most Read from BloombergIran Says Hormuz Closed Again as Talks With US Set to OpenUS and Iran Make ‘Progress’ in Talks, Aim to Keep Hormuz OpenMeta Taps New WhatsApp Boss as Part of $900 Million InvestmentIranian Negotiators Said to Still Be Engaged in Talks With USStocks Fall as SpaceX’s Rout Offsets US-Iran H",https://finance.yahoo.com/markets/stocks/articles/sony-plans-first-dollar-bond-041353535.html,['6758.T']
2026-06-20T12:09:39Z,Music Business Prospects Assert Sony Group Corporation (SONY) as one of the Best Falling Stocks to Invest In,"Sony Group Corporation (NYSE:SONY) is one of the best falling stocks to invest in, according to analysts. On June 17, Goldman Sachs reiterated its Buy rating on Sony Group Corporation (NYSE:SONY) with a JPY 4,100 price target, following a sell‑side meeting with the company’s music business management. According to the investment bank, the company is seeing […]",https://finance.yahoo.com/markets/stocks/articles/music-business-prospects-assert-sony-120939349.html,['6758.T']
2026-06-19T04:00:25Z,AI is turning Nintendo and Sony products into accidental luxury goods,The rush to build AI data centres has created all sorts of unexpected winners and losers. It’s a good time to sell electrical components or air...,https://finance.yahoo.com/technology/articles/ai-turning-nintendo-sony-products-040025072.html,['6758.T']
2026-06-17T14:20:00Z,Microsoft’s Xbox Problem Is Bigger Than a Console War,Restructuring the Xbox gaming division into a fully independent subsidiary could unlock massive shareholder value by protecting corporate profit margins.,https://www.marketbeat.com/originals/microsofts-xbox-problem-is-bigger-than-a-console-war/?utm_source=yahoofinance&utm_medium=yahoofinance,['6758.T']
2026-06-17T13:00:00Z,Sony Electronics' Professional Display Solutions Announces Winners of Annual Sony AV Partner Awards,"Sony Electronics' Professional Display Solutions of America team named the 2026 winners of its annual Sony AV Partner Awards. The awards, which launched last year, honor exceptional achievements among integrators, distributors, consultants, and channel partners. Winners were selected by a panel of Sony judges who analyzed professional display sales, field collaboration, and business growth. Statues were distributed during InfoComm 2026 to acknowledge the honor.",https://finance.yahoo.com/media-advertising/articles/sony-electronics-professional-display-solutions-130000254.html,['6758.T']
2026-06-16T15:31:43Z,Sony (SONY) Shows Why PlayStation’s Profit Story Is Moving Beyond Console Hardware,"Sony Group Corporation (NYSE:SONY) is one of the best e-gaming and sports betting stocks to buy now. The company’s gaming story is becoming less dependent on PlayStation 5 hardware shipments and more dependent on software, network services, and platform monetization. On May 8, Sony forecast fiscal 2026 Game & Network Services sales of 4.42 trillion […]",https://finance.yahoo.com/markets/stocks/articles/sony-sony-shows-why-playstation-153143364.html,['6758.T']
2026-06-16T13:07:00Z,MIPI Alliance Welcomes Sony Semiconductor Solutions as a Promoter Member,"BRIDGEWATER, N.J., June 16, 2026--The MIPI Alliance announced Sony Semiconductor Solutions was approved as its newest Promoter member. Hiroo Takahashi joins the board of directors.",https://finance.yahoo.com/technology/articles/mipi-alliance-welcomes-sony-semiconductor-130700572.html,['6758.T']
2026-06-16T06:39:49Z,Goldman-Backed Go Rises 10% After Biggest Japan IPO This Year,"(Bloomberg) -- Taxi-hailing app provider Go Inc.’s shares advanced 10% in its trading debut on the Tokyo Stock Exchange on Tuesday, helping to support investor sentiment after the nation’s largest initial public offering so far this year. Most Read from BloombergIran’s Deputy Foreign Minister Confirms Deal Reached With USStudios in Microsoft’s Xbox Division Brace for ClosuresNetanyahu Pays a Political Price for Trump’s Iran DealUS and Iran Agree to Halt War, Restart Middle East Oil ShipmentsUS a",https://finance.yahoo.com/markets/stocks/articles/goldman-backed-rises-10-biggest-063949521.html,['6758.T']
2026-06-15T17:27:20Z,Microsoft weighs an Xbox spinoff. Would it revive the business or put it at risk?,"With hardware sales falling and costs rising, a comeback would be anything but guaranteed.",https://www.fastcompany.com/91559703/microsoft-considers-spinning-off-xbox,['6758.T']
2026-06-15T14:06:08Z,Sony (TSE:6758) Stock Sees Modest Fair Value Cut On Split Analyst Revisions,"Sony Group’s fair value estimate has been reset to ¥4,657.05 from ¥4,764.78, signaling a modest recalibration of expectations rather than a wholesale rethink of the story. Behind this, analysts are weighing upside around content, gaming and potential corporate activity against concerns about memory costs and hardware profitability, which is feeding into a more balanced mix of target changes across the Street. As you read on, you will see how these shifting assumptions are shaping the current...",https://finance.yahoo.com/markets/stocks/articles/sony-tse-6758-stock-sees-140608145.html,['6758.T']
2026-06-12T21:50:02Z,Sony (SONY) Stock Sinks As Market Gains: What You Should Know,"In the most recent trading session, Sony (SONY) closed at $20.53, indicating a -2.93% shift from the previous trading day.",https://finance.yahoo.com/markets/stocks/articles/sony-sony-stock-sinks-market-215002148.html,['6758.T']
2026-06-11T15:37:00Z,"Zacks Industry Outlook Highlights Sony, Dolby Laboratories and Sonos","Sony, Dolby and Sonos are investing in immersive media, AI and digital ecosystems as the audio-video industry faces demand and cost pressures.",https://finance.yahoo.com/markets/stocks/articles/zacks-industry-outlook-highlights-sony-153700488.html,['6758.T']
2026-06-11T13:00:05Z,Sony Corporation (SONY) is Attracting Investor Attention: Here is What You Should Know,"Zacks.com users have recently been watching Sony (SONY) quite a bit. Thus, it is worth knowing the facts that could determine the stock's prospects.",https://finance.yahoo.com/markets/stocks/articles/sony-corporation-sony-attracting-investor-130005442.html,['6758.T']
2026-06-10T22:19:52Z,Xbox Plans Significant Layoffs as New CEO Plans Overhaul,(Bloomberg) -- Microsoft Corp.’s Xbox division is planning major job cuts next month as new Chief Executive Officer Asha Sharma overhauls the video game unit to stem declining revenue.Most Read from BloombergHouse Republican Says Hegseth’s D-Day Remarks ‘Inappropriate’Xbox Plans Significant Layoffs as New CEO Plans OverhaulUS Strikes Iran in Trump Escalation Over Stalled Peace TalksTech Stocks Sink as Oil Jumps on US-Iran Jitters: Markets WrapH-1B Visa Rules Have Changed Again. What to KnowThe l,https://finance.yahoo.com/markets/stocks/articles/xbox-plans-significant-layoffs-ceo-221952435.html,['6758.T']
2026-06-10T16:57:00Z,3 Audio Video Stocks to Watch as Industry Witnesses Headwinds,"Amid cautious discretionary spending and macro troubles, investments in cutting-edge solutions are likely to aid Zacks Audio Video Production industry participants like SONY, DLB and SONO.",https://finance.yahoo.com/markets/stocks/articles/3-audio-video-stocks-watch-165700417.html,['6758.T']
2026-06-09T09:26:17Z,Market Chatter: SONY Upgrades Struggling Xperia Smartphone With AI Features,"Sony (SONY) will release a new flagship version of its Xperia smartphone on Thursday, adding AI-enab",https://finance.yahoo.com/sectors/technology/articles/market-chatter-sony-upgrades-struggling-092617265.html,['6758.T']
2026-06-05T08:04:00Z,"Digital Signage Market by Product, Resolution, Installation Location, Software, Display Size, Application, and Region - Global Forecast to 2030","The global digital signage market is poised for significant growth, expanding from USD 21.45 billion in 2025 to USD 28.88 billion by 2030, with a CAGR of 6.1%. This growth is fueled by increased digital signage adoption across commercial spaces and a rising demand for high-resolution displays. Notably, the software segment is set to register the highest CAGR, catering to real-time content and immersive user experiences. Displays above 52 inches will dominate by 2030, driven by urbanization and t",https://finance.yahoo.com/sectors/technology/articles/digital-signage-market-product-resolution-080400603.html,['6758.T']
2026-06-04T14:15:00Z,How the Memory Shortage Is Crushing the Gaming Industry,Rising DRAM and NAND memory costs are pressuring margins at Nintendo and Sony while posing indirect launch risks for Take-Two Interactive's GTA6 release.,https://www.marketbeat.com/originals/how-the-memory-shortage-is-crushing-the-gaming-industry/?utm_source=yahoofinance&utm_medium=yahoofinance,['6758.T']
2026-06-04T06:10:41Z,A Look At Sony Group (TSE:6758) Valuation After A Recent Share Price Rebound,"Recent share performance and scale Sony Group (TSE:6758) has seen mixed share performance recently, with the stock down over the year to date but higher over the past month and past 3 months. This sets the backdrop for today’s snapshot. See our latest analysis for Sony Group. At a share price of ¥3,619.0, Sony Group’s recent 30-day share price return of 15.73% contrasts with a year to date share price decline of 11.28%, while the 5-year total shareholder return of 82.16% points to a stronger...",https://finance.yahoo.com/markets/stocks/articles/look-sony-group-tse-6758-061041196.html,['6758.T']
2026-06-03T15:31:42Z,"Still facing copyright lawsuits, AI music generator Suno raises another $400M","The prominent AI music-generation startup is now valued at over $5.4 billion -- about seven months ago, it raised at a $2.45 billion valuation.",https://finance.yahoo.com/sectors/technology/articles/still-facing-copyright-lawsuits-ai-153142980.html,['6758.T']
2026-06-02T14:00:00Z,Sony Electronics Bringing New Technologies Including Marquee Display Solutions and Powerful PTZ Cameras to InfoComm 2026,"Sony Electronics is showcasing its vast portfolio of professional AV solutions June 17-19, 2026, at InfoComm in Las Vegas, at booth C8301. Attendees can expect to see Sony's lineup of scalable innovations, including BRAVIA Professional LCD displays, Crystal LED video walls, business projectors, and SRG pan-tilt-zoom (PTZ) cameras in experiential settings, in addition to the company's expanding partner network. Visitors will get a real-world glimpse of use cases across a variety of verticals incl",https://finance.yahoo.com/sectors/technology/articles/sony-electronics-bringing-technologies-including-140000413.html,['6758.T']
2026-05-29T12:50:03Z,"If Spider-Man Wins 2026’s Box Office Crown, These Stocks Win Too","Prediction market traders have a clear favorite for 2026’s box office crown, and the ripple effects extend well beyond Hollywood. On Polymarket’s “Highest grossing movie in 2026?” market, Spider-Man: Brand New Day commands a 54.5% implied probability of finishing the year on top, comfortably ahead of Avengers: Doomsday at 19.5% and Toy Story 5 at ... If Spider-Man Wins 2026’s Box Office Crown, These Stocks Win Too",https://247wallst.com/investing/2026/05/29/if-spider-man-wins-2026s-box-office-crown-these-stocks-win-too/,['6758.T']
2026-05-28T19:35:44Z,"Sony Unveils $31,000 Bravia TV Ahead Of TCL Joint Venture",Sony launches new premium Bravia TVs and audio products before its home entertainment joint venture begins in 2027.,https://finance.yahoo.com/markets/stocks/articles/sony-unveils-31-000-bravia-193544825.html,['6758.T']
