date,title,content,link,symbols
2026-04-26T15:05:24Z,Assessing Sony Group (TSE:6758) Valuation After Mixed Share Performance And Diverging Fair Value Estimates,"Recent share performance and business scale Sony Group (TSE:6758) has seen mixed share performance, with a return of about 0% over the past month, a 9.5% decline over the past 3 months, and a 21.4% decline year to date. Over longer periods, total returns are about 33.7% for 3 years and 59.3% for 5 years, while the past year shows a 4.2% decline. This gives investors a varied picture depending on time horizon. The company reports annual revenue of ¥13.17b and net income of ¥1.25b, with annual...",https://finance.yahoo.com/markets/stocks/articles/assessing-sony-group-tse-6758-150524974.html,['6758.T']
2026-04-24T21:50:03Z,Sony (SONY) Stock Slides as Market Rises: Facts to Know Before You Trade,"Sony (SONY) closed at $20.28 in the latest trading session, marking a -1.02% move from the prior day.",https://finance.yahoo.com/markets/stocks/articles/sony-sony-stock-slides-market-215003404.html,['6758.T']
2026-04-24T10:30:00Z,Sony's AI robot is beating the best human ping pong players,"Sony (SONY) has built a ""ping pong robot"" that uses agentic artificial intelligence (AI) to beat expert human players. Yahoo Finance Tech Editor Dan Howley explains more.",https://finance.yahoo.com/video/sonys-ai-robot-beating-best-103000301.html,['6758.T']
2026-04-23T20:03:07Z,Sony Group (SONY): 8 Low Priced Stocks to Buy with Huge Upside Potential,"Sony Group Corporation (NYSE:SONY) is one of the low-priced stocks to buy with huge upside potential. On April 17, Reuters reported that the Japanese government announced that it would provide Sony with subsidies of up to 60 billion yen (~$380 million) for a new image sensor manufacturing plant. The facility will be located in the […]",https://finance.yahoo.com/markets/stocks/articles/sony-group-sony-8-low-200307996.html,['6758.T']
2026-04-23T16:46:01Z,Is Sony Group (SONY) Among the 10 Best Global Stocks to Buy According to Wall Street Analysts?,"Sony Group Corporation (NYSE:SONY) is included among the 10 Best Global Stocks to Buy According to Wall Street Analysts. Sony Group Corporation (NYSE:SONY) designs, develops, produces, and sells electronic equipment, instruments, and devices for the consumer, professional, and industrial markets around the world. On April 14, TD Cowen trimmed its price target on Sony Group […]",https://finance.yahoo.com/markets/stocks/articles/sony-group-sony-among-10-164601091.html,['6758.T']
2026-04-23T13:32:54Z,Sony faces new concerns as insurance unit investigates misconduct,Misconduct probe shakes confidence in operations,https://finance.yahoo.com/markets/stocks/articles/sony-faces-concerns-insurance-unit-133254804.html,['6758.T']
2026-04-23T12:06:29Z,Is Sony Group (TSE:6758) Pricing Reflect Its Mixed DCF And P/E Signals?,"If you are wondering whether Sony Group's current share price reflects its true worth, this breakdown will help you make sense of what the market might be pricing in. The stock closed at ¥3,259, with returns of a 4.3% decline over the past 7 days, 0.8% over 30 days, a 20.1% decline year to date, and a 2.4% decline over the last year, while still showing gains of 38.7% over 3 years and 49.4% over 5 years. Recent news flow around Sony Group has focused on its position as a diversified consumer...",https://finance.yahoo.com/markets/stocks/articles/sony-group-tse-6758-pricing-120629875.html,['6758.T']
2026-04-20T18:44:00Z,"Honda & Sony End Afeela EV Project, Eye Non-EV Opportunities","Honda ends Afeela EV with Sony, shifts focus to AI, audio tech, and non-EV opportunities while keeping partnership intact.",https://finance.yahoo.com/sectors/technology/articles/honda-sony-end-afeela-ev-184400049.html,['6758.T']
2026-04-20T16:30:00Z,Vadzo Imaging Expands NDAA Compliant Innova GigE Camera Portfolio with Six High Performance Industrial Vision Camera Models,"The Innova GigE camera lineup covers resolutions from 2MP to 8.46MP across six production ready models built on Sony STARVIS 2 IMX678, Sony STARVIS IMX715, Sony STARVIS IMX662, Sony Pregius S IMX900, Onsemi AR0521 and Onsemi AR0234 sensor platforms. ...",https://finance.yahoo.com/sectors/technology/articles/vadzo-imaging-expands-ndaa-compliant-163000230.html,['6758.T']
2026-04-20T09:51:17Z,Sony-Honda JV explores new options after EV cancellation – report,The JV said last month that development of the Afeela 1 had been halted after changes to Honda’s electrification plans.,https://www.just-auto.com/news/sony-honda-jv-explores-new-options/,['6758.T']
2026-04-17T21:50:04Z,Sony (SONY) Advances But Underperforms Market: Key Facts,"The latest trading day saw Sony (SONY) settling at $21.7, representing a +1.12% change from its previous close.",https://finance.yahoo.com/markets/stocks/articles/sony-sony-advances-underperforms-market-215004696.html,['6758.T']
2026-04-17T14:03:43Z,Sony Gets $380 Million Boost For Sensor Expansion,Japan backs chip supply for AI growth,https://finance.yahoo.com/sectors/technology/articles/sony-gets-380-million-boost-140343684.html,['6758.T']
2026-04-17T13:55:02Z,Wall Street Analysts Believe Sony (SONY) Could Rally 34.67%: Here's is How to Trade,"The mean of analysts' price targets for Sony (SONY) points to a 34.7% upside in the stock. While this highly sought-after metric has not proven reasonably effective, strong agreement among analysts in raising earnings estimates does indicate an upside in the stock.",https://finance.yahoo.com/markets/stocks/articles/wall-street-analysts-believe-sony-135502952.html,['6758.T']
2026-04-17T13:30:04Z,Sony (SONY) Is Considered a Good Investment by Brokers: Is That True?,"According to the average brokerage recommendation (ABR), one should invest in Sony (SONY). It is debatable whether this highly sought-after metric is effective because Wall Street analysts' recommendations tend to be overly optimistic. Would it be worth investing in the stock?",https://finance.yahoo.com/markets/stocks/articles/sony-sony-considered-good-investment-133004730.html,['6758.T']
2026-04-17T01:02:13Z,Sony to get up to $380 million image sensor factory Japan subsidy,"The Japanese government will ‌provide subsidies of ‌up to 60 billion yen ($380 million) ​to Sony for an image sensor plant in the western Japanese prefecture ‌of ⁠Kumamoto, industry minister Ryosei Akazawa said on ⁠Friday.  Image sensors will be ""indispensable for autonomous driving and ​physical AI"" ​and ""we ​hope a ‌stable supply of image sensors... will be secured,"" Akazawa said at a press conference.",https://finance.yahoo.com/economy/policy/articles/sony-380-million-image-sensor-010213049.html,['6758.T']
2026-04-16T07:05:32Z,Sony’s New XYN 3D Tools and LiveU Tie‑Up Could Be A Game Changer For Sony Group (TSE:6758),"In mid-April 2026, Sony Electronics detailed its XYN spatial capture solution for high‑quality 3DCG asset creation and LiveU announced an expanded collaboration integrating Sony’s file‑based workflow tools into the LiveU EcoSystem for broadcasters. Together, these moves highlight Sony’s push to deepen its integrated hardware‑software ecosystem in virtual production and professional broadcast workflows, potentially broadening use cases across film, gaming, and industrial 3D...",https://finance.yahoo.com/markets/stocks/articles/sony-xyn-3d-tools-liveu-070532101.html,['6758.T']
2026-04-15T22:00:05Z,Sony (SONY) Outpaces Stock Market Gains: What You Should Know,"In the latest trading session, Sony (SONY) closed at $21.24, marking a +1.38% move from the previous day.",https://finance.yahoo.com/markets/stocks/articles/sony-sony-outpaces-stock-market-220005217.html,['6758.T']
2026-04-14T11:00:00Z,"LiveU Announces Expanded Collaboration with Sony at NAB Show, Adding Direct File Workflow Integration","LiveU today announced a significant expansion of its collaboration with Sony Corporation, introducing integrated support for Sony's file-based workflow solutions across the LiveU EcoSystem.",https://finance.yahoo.com/sectors/technology/articles/liveu-announces-expanded-collaboration-sony-110000548.html,['6758.T']
2026-04-12T21:19:48Z,Sony Group Corporation (SONY): Mario Gabelli Remains Bullish on This Stock,"Sony Group Corporation (NYSE:SONY) is featured on the Mario Gabelli Stock Portfolio: Top 10 Stock Picks. Sony Group Corporation (NYSE:SONY) has been a staple in the 13F portfolio of GAMCO Investors since the third quarter of 2012. Back then, this position comprised just over 50,000 shares. The fund started loading up on the stock from […]",https://finance.yahoo.com/markets/stocks/articles/sony-group-corporation-sony-mario-211948242.html,['6758.T']
2026-04-09T17:30:19Z,Sony Group Corporation (SONY) to Acquire Cinemersive Labs,"Sony Group Corporation (NYSE:SONY) is one of the 7 Best Strong Buy Asian Stocks to Invest In. On April 3, 2026, Sony Group Corporation (NYSE:SONY) announced it has entered into an agreement to acquire Cinemersive Labs, a UK-based machine learning and computer vision company founded in 2022. Sony said the Cinemersive team will join Sony […]",https://finance.yahoo.com/markets/stocks/articles/sony-group-corporation-sony-acquire-173019553.html,['6758.T']
2026-04-08T22:00:06Z,Sony (SONY) Ascends But Remains Behind Market: Some Facts to Note,"In the most recent trading session, Sony (SONY) closed at $21.38, indicating a +2.39% shift from the previous trading day.",https://finance.yahoo.com/markets/stocks/articles/sony-sony-ascends-remains-behind-220006162.html,['6758.T']
2026-04-07T17:55:30Z,Sector Update: Consumer Stocks Fall in Afternoon Trading,"Consumer stocks were lower Tuesday afternoon, with the State Street Consumer Staples Select Sector S",https://finance.yahoo.com/markets/stocks/articles/sector-consumer-stocks-fall-afternoon-175530675.html,['6758.T']
2026-04-04T10:10:33Z,Sony TCL Deal Reshapes Home Entertainment Role And Investor Focus,"Sony Group (TSE:6758) has agreed to form a new home entertainment joint venture with TCL. The deal transfers a majority stake and global TV and audio product operations to TCL, including manufacturing facilities. The partnership affects Sony branded consumer TVs and audio products across key international markets. Sony Group (TSE:6758) is known for its entertainment, gaming, imaging, and consumer electronics businesses, with TVs and audio products serving as core branded offerings. The new...",https://finance.yahoo.com/markets/stocks/articles/sony-tcl-deal-reshapes-home-101033560.html,['6758.T']
2026-03-31T15:30:56Z,"Sony Group (SONY) to Raise Global Prices of PlayStation 5 Consoles, Reuters Reports","Sony Group Corporation (NYSE:SONY) is one of the best oversold stocks to buy under $20. Reuters reported on March 27 that Sony Group Corporation (NYSE:SONY) is raising the global prices of its PlayStation 5 consoles, which includes a $100 ​increase in the United States. This marks its second hike in less than a year, with the […]",https://finance.yahoo.com/markets/stocks/articles/sony-group-sony-raise-global-153056049.html,['6758.T']
2026-03-30T15:01:02Z,AI Governance for Boards: A Framework by Robert Maciejko,"By Karen Roman A majority of institutions incorporate AI as part of their main business functions, yet many boards do not have formal oversight structures for AI governance, according to a governance framework paper published on research platform SSRN. The paper proposed a practical approach to support boards on AI management that includes the STAR […] The post AI Governance for Boards: A Framework by Robert Maciejko appeared first on CorpGov.",https://finance.yahoo.com/sectors/technology/articles/ai-governance-boards-framework-robert-150102664.html,['6758.T']
2026-03-30T14:04:00Z,Microsoft Rides on Expanding Xbox Gaming Roster: What's Ahead?,"MSFT bets on a surge of Xbox titles and Game Pass additions, but weak gaming revenues and tough comps keep its turnaround story unfinished.",https://finance.yahoo.com/markets/stocks/articles/microsoft-rides-expanding-xbox-gaming-140400014.html,['6758.T']
2026-03-28T02:06:29Z,Is Sony Group (TSE:6758) Now Fairly Priced After This Year’s 21% Share Price Slide,"Investors may be wondering whether Sony Group's current share price reflects its real worth, or if the market is mispricing the stock. The stock has seen a 21.3% decline year to date and an 11.9% decline over the last 12 months, while the 3 year and 5 year returns are 42.6% and 41.8% respectively. Recent headlines have focused on Sony Group's positioning within consumer durables and the ongoing market reaction to that role. This helps explain some of the recent share price moves. Broader...",https://finance.yahoo.com/markets/stocks/articles/sony-group-tse-6758-now-020629059.html,['6758.T']
2026-03-27T21:28:26Z,Sony PS5 Price Hikes: Why Raised Prices Could Signal a Red Flag for the Global Economy,SONY raised its PS5 prices by $150. Here’s what it means for the Sony stock as well as the global economy.,https://www.barchart.com/story/news/1014531/sony-ps5-price-hikes-why-raised-prices-could-signal-a-red-flag-for-the-global-economy,['6758.T']
2026-03-27T19:08:06Z,Sony to hike PS5 prices by $100 as AI and Iran war push up memory chip costs,Updated prices of PlayStation 5 consoles to go into effect on 2 April as electronics makers face rising cost pressures,https://finance.yahoo.com/sectors/technology/articles/sony-hike-ps5-prices-100-190806546.html,['6758.T']
2026-03-27T16:30:35Z,"Sony hikes PS5 price an extra $100 as tariff crunch, memory shortage wreak havoc on games industry","Sony is increasing the price of its PS5 console yet again, this time by an extra $100.",https://finance.yahoo.com/sectors/technology/article/sony-hikes-ps5-price-an-extra-100-as-tariff-crunch-memory-shortage-wreak-havoc-on-games-industry-163035099.html,['6758.T']
2026-03-27T15:52:51Z,Sony raises PS5 prices by up to $150 amid global pressure,"The hike, Sony's second in less than a year, takes effect April 2 and covers the PS5, PS5 Pro, and PlayStation Portal",https://qz.com/sony-ps5-price-increase-150,['6758.T']
2026-03-26T09:27:18Z,"Honda, Sony reviewing the future of their BEV joint venture",Sony Honda Mobility announces cancellation of Afeela 1 and 2 models.,https://www.just-auto.com/news/honda-sony-reviewing-the-future-of-their-bev-joint-venture/,['6758.T']
2026-03-25T17:30:00Z,Honda Sony Mobility cancels planned EVs,"The partners are reevaluating the future of the JV, which was set to launch the Afeela 1 sedan in California later this year.",https://www.wardsauto.com/news/sony-honda-mobility-cancel-afeela1-evs-reevaluating-joint-venture-future/815719/,['6758.T']
2026-03-25T13:00:04Z,Sony Corporation (SONY) Is a Trending Stock: Facts to Know Before Betting on It,"Sony (SONY) has been one of the stocks most watched by Zacks.com users lately. So, it is worth exploring what lies ahead for the stock.",https://finance.yahoo.com/markets/stocks/articles/sony-corporation-sony-trending-stock-130004303.html,['6758.T']
2026-03-24T23:04:35Z,Sony Nears $1 Billion TCL Deal for Home Entertainment Unit,Talks advance on majority stake sale tied to planned 51/49 TV joint venture using TCL display technology,https://finance.yahoo.com/markets/stocks/articles/sony-nears-1-billion-tcl-230435239.html,['6758.T']
2026-03-23T21:50:04Z,Why Sony (SONY) Outpaced the Stock Market Today,"Sony (SONY) closed the most recent trading day at $20.68, moving +2.27% from the previous trading session.",https://finance.yahoo.com/markets/stocks/articles/why-sony-sony-outpaced-stock-215004667.html,['6758.T']
2026-03-23T18:19:16Z,"Sony Group (SONY) Margins at Risk Amid Rising Memory Prices, Bernstein Warns","Sony Group Corporation (NYSE:SONY) is one of the top Robinhood stocks with high potential. On March 16, analysts at Bernstein SocGen Group downgraded Sony Group Corporation (NYSE:SONY) to Market Perform from Outperform, setting a price target of JPY3,400.00. The downgrade underscores the research firm’s concern that the company could bear the brunt of rising memory […]",https://finance.yahoo.com/markets/stocks/articles/sony-group-sony-margins-risk-181916287.html,['6758.T']
2026-03-22T22:06:54Z,A Look At Sony Group (TSE:6758) Valuation After Recent Share Price Weakness,"Why Sony Group (TSE:6758) is on investors’ radar today Sony Group (TSE:6758) has drawn attention after a period of weaker share performance, with the stock showing negative returns over the past week, month, past 3 months, and year to date. See our latest analysis for Sony Group. The recent 5.4% 7 day share price decline and 19.8% year to date share price retreat contrast with a 54.7% five year total shareholder return, suggesting long term holders have still seen gains even as shorter term...",https://finance.yahoo.com/markets/stocks/articles/look-sony-group-tse-6758-220654229.html,['6758.T']
2026-03-20T13:30:05Z,Wall Street Analysts See Sony (SONY) as a Buy: Should You Invest?,"The average brokerage recommendation (ABR) for Sony (SONY) is equivalent to a Buy. The overly optimistic recommendations of Wall Street analysts make the effectiveness of this highly sought-after metric questionable. So, is it worth buying the stock?",https://finance.yahoo.com/markets/stocks/articles/wall-street-analysts-see-sony-133005712.html,['6758.T']
2026-03-19T22:00:05Z,Sony (SONY) Increases Despite Market Slip: Here's What You Need to Know,"Sony (SONY) closed the most recent trading day at $20.62, moving +1.18% from the previous trading session.",https://finance.yahoo.com/markets/stocks/articles/sony-sony-increases-despite-market-220005071.html,['6758.T']
2026-03-17T20:20:39Z,Sony Feels The Ripple Effects Of AI Demand,Rising memory costs pressure PS5 margins,https://finance.yahoo.com/news/sony-feels-ripple-effects-ai-202039023.html,['6758.T']
2026-03-12T13:00:00Z,Applications Now Open for the 2027 Sony Women in Technology Award with   Nature,"Sony Group Corporation (Sony) and Nature today announced the application cycle for the 2027 Sony Women in Technology Award with Nature is now open. The annual award, launched to champion promising women researchers during crucial phases in their research and career development, recognizes three outstanding early‑ to mid‑career women researchers in technology—including science, engineering, and mathematics—whose work is driving positive impact for society and the planet.",https://finance.yahoo.com/news/applications-now-open-2027-sony-130000571.html,['6758.T']
2026-03-11T21:23:01Z,Sony Group (SONY) on Mario Gabelli’s Radar Despite Media and Gaming Concerns,"Sony Group Corp. (NYSE:SONY) is one of the best stocks to buy according to billionaire Mario Gabelli. Sony Group Corp. (NYSE:SONY) is the 8th-largest holding for GAMCO Investors, with a 13F investment value of $127.4 million as of the end of Q4 2025. The hedge fund reduced its position in Q4 to 4.98 million shares, […]",https://finance.yahoo.com/news/sony-group-sony-mario-gabelli-212301135.html,['6758.T']
2026-03-11T15:12:26Z,Sony Accessibility Push At CSUN And What It Might Mean For Valuation,"Sony Group (TSE:6758) is highlighting accessibility and inclusive design features at the CSUN Assistive Technology Conference. The company is presenting accessibility functions across BRAVIA TVs, Alpha cameras, wireless headphones, and retail kiosks with Braille and audio descriptions. The focus is on improving usability for people with visual, hearing, and motor impairments across Sony's consumer electronics ecosystem. Sony Group, known for its consumer electronics, entertainment, and...",https://finance.yahoo.com/news/sony-accessibility-push-csun-might-151226300.html,['6758.T']
2026-03-11T13:00:06Z,Investors Heavily Search Sony Corporation (SONY): Here is What You Need to Know,"Zacks.com users have recently been watching Sony (SONY) quite a bit. Thus, it is worth knowing the facts that could determine the stock's prospects.",https://finance.yahoo.com/news/investors-heavily-search-sony-corporation-130006359.html,['6758.T']
2026-03-11T10:10:20Z,Will Sony’s Expanded Buyback and UK PlayStation Lawsuit Reshape Sony Group's (TSE:6758) Narrative?,"In late February 2026, Sony Group’s board approved an expanded share repurchase authorization to buy back up to 90,000,000 shares for ¥250,000 million, while the company also faced the opening of a roughly £2 billion UK class action trial alleging competition law breaches in PlayStation Store digital sales. Alongside highlighting shareholder returns via buybacks, the lawsuit places renewed focus on the legal and reputational risks attached to Sony’s core gaming ecosystem and digital...",https://finance.yahoo.com/news/sony-expanded-buyback-uk-playstation-101020313.html,['6758.T']
2026-03-10T15:14:44Z,Sony fighting $2.7 billion UK lawsuit over PlayStation Store prices,"Sony is fighting a London lawsuit worth almost 2 billion pounds ($2.7 billion) that alleges the PlayStation maker's ""monopoly position"" inflated prices ‌for digital games, in the latest mass consumer case to go to trial ‌in Britain.  The Japanese conglomerate is accused of abusing its dominant position by requiring digital games and add-ons for ​its console to be bought and sold only via its PlayStation Store, making prices higher than for physical games.  Sony says it has ""invested years and billions"" in an integrated gaming platform that benefits consumers in a competitive market, where rivals Nintendo and Microsoft's Xbox use similar models.",https://finance.yahoo.com/news/sony-fighting-2-7-billion-151444485.html,['6758.T']
2026-03-09T19:04:00Z,"Sony Electronics Showcases ""Accessibility for All"" Innovations at CSUN 2026","Sony Electronics will participate in the 41st CSUN Assistive Technology Conference, taking place Tuesday, March 10 through Friday, March 13 in Anaheim, Calif.",https://finance.yahoo.com/news/sony-electronics-showcases-accessibility-innovations-190400002.html,['6758.T']
2026-03-07T14:09:47Z,Assessing Sony Group (TSE:6758) Valuation After Mixed Short And Long Term Share Returns,"Why Sony Group is on investors’ radar today Sony Group (TSE:6758) has been drawing attention after a period of mixed share performance, with the stock showing a gain over the past month alongside a negative move over the past 3 months and year to date. See our latest analysis for Sony Group. At a share price of ¥3,473.0, Sony Group’s 1 day share price return of 2.75% contrasts with a 30 day share price return of 3.83% and a 90 day share price return of a 19.83% decline, while the 5 year total...",https://finance.yahoo.com/news/assessing-sony-group-tse-6758-140947557.html,['6758.T']
2026-03-07T13:00:21Z,Sony hack: Former CEO shares the untold story,"Michael Lynton, Snap Inc. Chairperson, revisits one of Hollywood’s most infamous moments: the Sony hack. Lynton shares the moment he first learned of the cyberattack and reflects on the high-stakes decision to greenlight The Interview, a choice that would spark months of fallout.",https://finance.yahoo.com/video/sony-hack-former-ceo-shares-130021223.html,['6758.T']
2026-03-07T13:00:02Z,Inside the Sony hack: the CEO call that changed everything,"Chairperson of Snap Inc., Michael Lynton, and Bloomberg Senior Advisor, Josh Steiner, unpack the high-stakes mistakes that shaped their careers. Lynton reflects on the decision to greenlight The Interview, the fallout from the Sony Pictures hack that followed, and what leaders can learn from failure. Together, they explore why confronting mistakes, rather than hiding from them, can be the key to stronger leadership and long-term success.",https://finance.yahoo.com/video/inside-sony-hack-ceo-call-130002356.html,['6758.T']
2026-03-06T15:25:00Z,"GoPro Posts Q4 Loss, Revenues Miss Estimates, Stock Down",GPRO posts Q4 loss vs. expected profit as revenue misses estimates. The company plans GP3 AI processor to power new cameras in 2026.,https://finance.yahoo.com/news/gopro-posts-q4-loss-revenues-152500203.html,['6758.T']
2026-03-05T05:01:00Z,Sony Doubles Down on PlayStation 5 Even as Console Costs Level Up,"The cost of producing gaming consoles on the up, but Sony is doubling down on its PlayStation 5 and reportedly pulling titles away from PCs.",https://www.thedailyupside.com/industries/media-entertainment/sony-doubles-down-on-playstation-5-even-as-console-costs-level-up/,['6758.T']
2026-03-02T05:00:16Z,Sony battles £2bn lawsuit claiming UK PlayStation users are overcharged for games,Sony is preparing to defend a £2bn lawsuit over claims that millions of PlayStation users in the UK are overcharged for games on the console...,https://finance.yahoo.com/news/sony-battles-2bn-lawsuit-claiming-050016665.html,['6758.T']
2026-03-01T01:13:13Z,InterDigital’s 6G Sensing Breakthrough And Sony Deal Shape Licensing Outlook,"InterDigital (NasdaqGS:IDCC) and Türk Telekom completed what they describe as the world's first collaborative cellular and Wi-Fi sensing implementation using a preliminary 6G architecture. The 6G sensing trial showcases integrated sensing and communication concepts with potential applications across multiple industries. Separately, InterDigital announced a new global patent license agreement with Sony, covering use of its intellectual property portfolio. For you as an investor, these...",https://finance.yahoo.com/news/interdigital-6g-sensing-breakthrough-sony-011313522.html,['6758.T']
