query_ticker,date,title,content,link,symbols,tags,sentiment.polarity,sentiment.neg,sentiment.neu,sentiment.pos
AVGO.US,2026-06-22T11:45:00+00:00,Can Analog Devices Sustain Margin Expansion Throughout 2026?,"Analog Devices' ADI margins have been improving for the past several quarters. In the second quarter of fiscal 2026, ADI posted a gross margin of 73%, up from 69.4% in the year-ago quarter. ADI's adjusted operating margin was 49% in the second quarter of fiscal 2026 compared with 41.2% in the previous year quarter.

The pattern has remained similar for the past six months, suggesting Analog Devices' strong, profitable business model across segments. ADI has been riding on a combination of a favorable business mix, higher factory utilization, pricing strength and disciplined operational execution.

The company's growth is accelerating, driven by ADI's highest-value markets, including Industrial, Aerospace & Defense, Automated Test Equipment (ATE), Electronic Test & Measurement (ETM), Data Center, and advanced Automotive applications. These businesses typically command premium pricing due to their performance requirements, long product lifecycles and mission-critical nature.

Industrial remains ADI's most profitable business and was the primary growth engine during the quarter. It accounted for 50% of revenues. Industrial grew 56% year over year and 20% sequentially. Management highlighted Aerospace & Defense, ATE, ETM, and the broad market business as key contributors.

Importantly, Industrial businesses beyond ATE and Aerospace grew more than 40% during the first half of fiscal 2026, indicating broad-based strength across automation, energy, healthcare and industrial automation markets. Communications was the fastest-growing end market, increasing 79% year over year. Within this segment, Data Center revenues surged more than 90%, driven by strong demand for ADI's optical and power solutions supporting AI infrastructure.

Management described both the Data Center and ATE businesses as being on steep growth trajectories with confidence extending into 2027. Overall, ADI's margin expansion is being fueled by rapid growth in its highest-margin, most differentiated businesses, creating a powerful combination of revenue acceleration and operating leverage.

How Competitors Fare Against Analog Devices

Analog Devices competes with Texas Instruments TXN in the industrial segment and with Broadcom AVGO in the communications segment, which are also two of ADI's strongest segments in terms of revenue growth and profit margin.

Texas Instruments competes with ADI in industrial signal chains, precision sensing and power management, especially in PLCs, factory automation and motor control. STMicroelectronics competes in industrial MCUs, motor drivers, sensors and automation systems. In the Communications segment, Texas Instruments competes with ADI in analog/mixed-signal, RF front-ends, power amp/driver ICs, ADCs/DACs in infrastructure and wireless systems.

Story Continues

Broadcom is strong in networking, data center, broadband, Wi-Fi, Ethernet PHYs and switches. In the communications segment, Broadcom mainly competes with its high-speed connectivity, optical / wireline networking equipment and cable or broadband IC portfolio. Despite strong competition from Texas Instruments and Broadcom, Analog Devices has enough scope to grow in the communications space as new 5G technology is being introduced, which gives scope for expansion to all the players.

ADI's Price Performance, Valuation and Estimates

Shares of ADI have gained 60.2% year to date compared with the Zacks Semiconductor - Analog and Mixed industry's growth of 69.7%.

ADI YTD Performance ChartZacks Investment Research

Image Source: Zacks Investment Research

From a valuation standpoint, ADI trades at a forward price-to-sales ratio of 13.43X, higher than the industry's average of 10.88X.

ADI Forward 12-Month (P/S) Valuation ChartZacks Investment Research

Image Source: Zacks Investment Research

The Zacks Consensus Estimate for ADI's fiscal 2026 and 2027 earnings implies year-over-year growth of 59% and 14%, respectively. The consensus estimate for fiscal 2025 and 2026 has remained unchanged in the past 30 days.Zacks Investment Research

Image Source: Zacks Investment Research

ADI currently sports a Zacks Rank #2 (Buy). You can see the complete list of today's Zacks #1 Rank (Strong Buy) stocks here.

Want the latest recommendations from Zacks Investment Research? Today, you can download 7 Best Stocks for the Next 30 Days. Click to get this free report

Analog Devices, Inc. (ADI) : Free Stock Analysis Report

Texas Instruments Incorporated (TXN) : Free Stock Analysis Report

Broadcom Inc. (AVGO) : Free Stock Analysis Report

This article originally published on Zacks Investment Research (zacks.com).

Zacks Investment Research

View Comments",https://finance.yahoo.com/markets/stocks/articles/analog-devices-sustain-margin-expansion-114500004.html,"['ADI.US', 'ANL.DU', 'ANL.F', 'ANL.HA', 'ANL.HM', 'ANL.MU', 'AVGO.US', 'TXN.US']","['AI-INFRASTRUCTURE', 'COMMUNICATIONS', 'CONSENSUS ESTIMATE', 'DATA-CENTER', 'INDUSTRIAL', 'REVENUE GROWTH', 'SEMICONDUCTORS']",0.998,0.009,0.855,0.136
AVGO.US,2026-06-22T10:21:00+00:00,The AI Boom Is Entering A New Phase -- And Nvidia May Not Be The Biggest Winner,"Key Points

Nvidia’s GPUs dominated the AI training market. But Broadcom’s custom ASICs could conquer the AI inference market. 10 stocks we like better than Broadcom ›

Nvidia(NASDAQ: NVDA), the world's largest producer of data center GPUs, has been one of the biggest beneficiaries of the AI boom. The world's top AI companies use its GPUs to train their large language models (LLMs), and it locks in its customers with its proprietary software.

From fiscal 2022 to fiscal 2026 (which ended this January), Nvidia's revenue and EPS grew at CAGRs of 68% and 89%, respectively. That's why its stock surged more than 1,000% over the past five years. It's still a great long-term AI play, but another tech giant might generate even more impressive gains over the next few years as the AI market enters a new phase.

Where to invest $1,000 right now? Our analyst team just revealed what they believe are the 10 best stocks to buy right now, when you join Stock Advisor. See the stocks »

Image source: Getty Images.

What new phase is the AI market entering?

Over the past few years, many AI companies have focused on training their algorithms by feeding them massive amounts of data. These training sessions, which can run for weeks to months, use large clusters of Nvidia's GPUs in data centers.

But today, inference -- or the act of using software to access that trained data -- is becoming the next big growth phase of the AI market. As hyperscalers try to reduce the high costs of running their AI models around the clock, they're shifting away from Nvidia's general-purpose GPUs toward specialized application-specific integrated circuits (ASICs).

Instead of being jacks-of-all-trades, ASICs are customized for specific tasks. At scale, these specialized chips can be more cost-efficient than Nvidia's GPUs for handling inference tasks. Therefore, Broadcom (NASDAQ: AVGO) -- which controls about 70% of the ASIC market -- will likely experience a major growth spurt as more AI companies ramp up their investments in inference-driven technologies.

Why could Broadcom be an even bigger winner than Nvidia?

Broadcom already produces custom ASICs for Alphabet's Google, Meta Platforms, OpenAI, and Anthropic. In fiscal 2025 (which ended last November), its AI chip sales soared 65% to $20 billion, accounting for 31% of its top line. It expects that figure to rise to $100 billion in fiscal 2027.

From fiscal 2025 to fiscal 2027, analysts expect Broadcom's revenue and adjusted earnings before interest, taxes, depreciation, and amortization (EBITDA) to both grow at CAGRs of about 53%. Its soaring AI chip sales should offset slower sales of non-AI chips (including wireless, mobile, data center, storage, and industrial markets) and infrastructure software (which it increased its exposure to over the past decade via several major acquisitions).

Broadcom already has an enterprise value of $1.98 trillion, but it trades at just 16 times next year's adjusted EBITDA. That low valuation will attract more investors seeking the next big AI stock -- and Broadcom could be a better play on the inference market than Nvidia.

Should you buy stock in Broadcom right now?

Before you buy stock in Broadcom, consider this:

The Motley Fool Stock Advisor analyst team just identified what they believe are the 10 best stocks for investors to buy now… and Broadcom wasn’t one of them. The 10 stocks that made the cut could produce monster returns in the coming years.

Consider when Netflix made this list on December 17, 2004... if you invested $1,000 at the time of our recommendation, you’d have $417,305!* Or when Nvidia made this list on April 15, 2005... if you invested $1,000 at the time of our recommendation, you’d have $1,293,148!*

Now, it’s worth noting Stock Advisor’s total average return is 936% — a market-crushing outperformance compared to 209% for the S&P 500. Don't miss the latest top 10 list, available with Stock Advisor, and join an investing community built by individual investors for individual investors.

See the 10 stocks »

*Stock Advisor returns as of June 22, 2026.

Leo Sun has positions in Meta Platforms. The Motley Fool has positions in and recommends Alphabet, Broadcom, Meta Platforms, and Nvidia. The Motley Fool has a disclosure policy.

The views and opinions expressed herein are the views and opinions of the author and do not necessarily reflect those of Nasdaq, Inc.",https://www.nasdaq.com/articles/ai-boom-entering-new-phase-and-nvidia-may-not-be-biggest-winner,"['AVGO.US', 'GOOG.US', 'GOOGL.US', 'META.US', 'NVDA.US']","['AI', 'ASIC', 'INFERENCE', 'MARKETS', 'SEMICONDUCTORS', 'TECH']",0.997,0.021,0.867,0.112
AVGO.US,2026-06-22T09:26:00+00:00,Prediction: 3 Trillion-Dollar Stocks Set to Leapfrog SpaceX by the End of 2026,"It's been a history-packed year for Wall Street -- and it's not even half over. Through June 18, we've witnessed the Dow Jones Industrial Average, S&P 500, and Nasdaq Composite climb to new highs, the arrival of a new Fed chair, and the largest-ever initial public offering (IPO) burst onto the scene.

On June 12, Space Exploration Technologies (SpaceX)(NASDAQ: SPCX) officially unseated Saudi Aramco for the title of largest IPO cash raise in history. The $75 billion raised by Musk's artificial intelligence (AI) and space economy goliath nearly tripled the capital raised from Saudi Aramco's December 2019 IPO.

Missed Nvidia in 2009? This Rare Signal Is Flashing Again. In 2009, a ""Double Down"" signal flashed for a little-known chipmaker called Nvidia. For the first time in years, that same ""Total Conviction"" signal is flashing for a company 1/100th the size of Nvidia. Continue »Image source: Getty Images.

History hasn't been kind to mega-IPOs

In the days following SpaceX's debut, its shares skyrocketed to a nearly $3 trillion valuation. For a brief moment, SpaceX was worth more than established industry leaders Microsoft and Amazon. But these gains proved fleeting, as should much of the retail investor euphoria surrounding SpaceX.

While structural changes will allow SpaceX fast entry into several major stock indexes, and its low float is helping buoy its share price, these dynamics will be relatively short-lived. Once the company's staggered lockup schedule takes effect, we'll witness the greatest wealth transfer in Wall Street's storied history, from retail investors to SpaceX insiders.

Over several months, insider selling, potentially dilutive debt and/or equity offerings, and the company's abysmal operating results all threaten to crater SpaceX's share price.

History hasn't been particularly kind to mega-IPOs over the last 14 years, either. According to research from Truist Financial, the average year-one drawdown for 30 of the largest tech IPOs of the last 14 years is a staggering 55%!

Long story short, SpaceX's $2 trillion-plus valuation is more mirage than foundation. Eventually, its share price is going to crater, allowing several other worthy trillion-dollar companies to leapfrog it in market cap. By the end of 2026, SpaceX should be looking up at the following three established trillion-dollar stocks.

1. Meta Platforms: $1.47 trillion market cap

The first trillion-dollar club member that shouldn't have any trouble jumping past SpaceX's bloated valuation before the end of this year is social media titan Meta Platforms (NASDAQ: META). Despite some concerns about Meta's aggressive capital expenditures tied to its AI infrastructure build-out, there are several reasons to believe its shares will head higher.

Story Continues

For starters, Meta's social media platforms have an unrivaled lure. Collectively, the company's family of apps, including Facebook, Instagram, WhatsApp, Threads, and Facebook Messenger, attracted an average of 3.56 billion daily users in March 2026. With no other social platform close to attracting this many eyeballs, it's no surprise that Meta can command an ad pricing premium from businesses.

Mark Zuckerberg's company is also one of the few that has enjoyed immediate benefits from integrating AI solutions. Giving businesses access to generative AI solutions capable of tailoring static and video messages to users can improve ad click-through rates and enhance Meta's ad pricing power.

Unlike SpaceX, which is a long way from generating recurring profits, Meta can offer investors an intriguing value proposition. Meta ended the June 18 trading session at a forward price-to-earnings (P/E) ratio of less than 16, representing a 23% discount to its average forward P/E over the trailing half-decade.Warren Buffett retired as Berkshire Hathaway's CEO on Dec. 31, 2025. Image source: The Motley Fool.

2. Berkshire Hathaway: $1.06 trillion market cap

Slow and steady wins the race. Although the conglomerate that now-retired billionaire Warren Buffett built into a trillion-dollar business is trailing SpaceX's market cap by nearly $1.4 trillion, Berkshire Hathaway (NYSE: BRKA)(NYSE: BRKB) has the potential to leapfrog Musk's SpaceX in the valuation column.

One unique trait that Berkshire Hathaway possesses is its treasure chest. For 14 consecutive quarters (ended March 31, 2026), Berkshire's bosses have been net sellers of stocks to the tune of approximately $195 billion. When coupled with the ongoing profits of Berkshire's operating segments, the company's cash pile, including U.S. Treasury bills, has ballooned to more than $397 billion. This capital provides a very safe floor beneath Berkshire's stock, and gives the company's new CEO, Greg Abel, unparalleled financial flexibility.

To build on the previous point, many of Berkshire Hathaway's operating segments are cyclical and predictable -- two traits Wall Street values highly. Since economic expansions last substantially longer than recessions, Buffett and Abel have angled their company's operating segments to capitalize on prolonged periods of growth.

A welcome return to share buybacks under Abel's leadership is another catalyst that can lift Berkshire's stock in 2026. Over the last eight years, Buffett and Abel have collectively spent $78 billon to repurchase their company's stock.

3. Broadcom: $1.96 trillion market cap

Although it's the smallest reach of the three stocks, networking specialist Broadcom (NASDAQ: AVGO) has the tools and intangibles needed to surpass SpaceX's market cap before the year ends. Broadcom ended the June 18 trading session at a $480 billion market cap deficit to Musk's space and artificial intelligence giant.

The immediate lure for Broadcom is its integral role in the AI data center build-out. Its solutions are capable of connecting tens of thousands of graphics processing units (GPUs) to maximize GPU compute capabilities and minimize tail latency.

Additionally, Broadcom's application-specific integrated circuits (ASICs) may become staples for select AI hyperscalers. While Nvidia remains the face of AI data center infrastructure, Broadcom's customized AI chips can support eyebrow-raising sales growth from hyperscalers for the foreseeable future.

The one worry for Broadcom is that game-changing innovations have a poor early track record. Every major innovation since the advent and proliferation of the internet in the mid-1990s has endured an early stage bubble-bursting event. Broadcom's saving grace is that it has numerous operating segments beyond AI, including wireless chips used in smartphones. If the AI bubble bursts, Broadcom can still handily outperform SpaceX.

Should you buy stock in Meta Platforms right now?

Before you buy stock in Meta Platforms, consider this:

The Motley Fool Stock Advisor analyst team just identified what they believe are the 10 best stocks for investors to buy now… and Meta Platforms wasn't one of them. The 10 stocks that made the cut are built for long-term growth and could produce monster returns in the coming years.

Consider when Netflix made this list on December 17, 2004... if you invested $1,000 at the time of our recommendation, you'd have $417,305!* Or when Nvidia made this list on April 15, 2005... if you invested $1,000 at the time of our recommendation, you'd have $1,293,148!*

That performance is why people listen. With a track record of beating the S&P 500 by 4x, Stock Advisor offers a distinct advantage. Don't miss the latest top 10 list, available with Stock Advisor, and join an investing community built for the long haul.

See the 10 stocks »

*Stock Advisor returns as of June 22, 2026.

Sean Williams has positions in Amazon and Meta Platforms. The Motley Fool has positions in and recommends Amazon, Berkshire Hathaway, Broadcom, Meta Platforms, Microsoft, Nvidia, and Truist Financial. The Motley Fool has a disclosure policy.

Prediction: 3 Trillion-Dollar Stocks Set to Leapfrog SpaceX by the End of 2026 was originally published by The Motley Fool

View Comments",https://finance.yahoo.com/markets/stocks/articles/prediction-3-trillion-dollar-stocks-092600268.html,"['2222.SR', 'AVGO.US', 'BRKA.US', 'BRKB.US', 'DJI.INDX', 'META.US', 'NVDA.US', 'SPCX.US']","['AI', 'INITIAL PUBLIC OFFERING', 'IPO', 'SEMICONDUCTORS', 'SHARE PRICE', 'SOCIAL-MEDIA', 'TECH']",0.998,0.033,0.86,0.107
