query_ticker,date,title,content,link,symbols,tags,sentiment.polarity,sentiment.neg,sentiment.neu,sentiment.pos
AVGO.US,2026-06-23T23:30:02+00:00,AMEN Properties Just Announced a 25% Dividend Increase. What This Means for the High-Yield Royalty Stock.,"Dividends and dollars by MarkgrafAve via iStock

AMEN Properties (AMEN) just raised its dividend by 25%, a move that signals real confidence in its ability to keep generating cash. The timing is also worth noting because it comes as more companies lean into shareholder payouts.

In the latest dividend roundup, AMEN appeared alongside Mastercard (MA), Dell (DELL), FedEx (FDX), HEICO (HEI), and Broadcom (AVGO) all of which either raised or declared dividends. That lineup points to a broader push toward returning more cash to investors across different sectors.

More News from Barchart

Marvell Just Got a New Street-High Price Target. Wall Street Thinks Networking Is a Huge Growth Opportunity. Verizon Is Trying to Rebuild Itself from the Inside Out. It Still Pays a 6.2% Dividend Too. AbbVie Just Sparked a 46% Rally in Apogee. Here's Why This $10.9 Billion Deal Could Be a Win for AbbVie Investors. Markets move fast. Keep up by reading our FREE midday Barchart Brief newsletter for exclusive charts, analysis, and headlines.

AMEN Properties fits into that story as a high-yield royalty stock. It owns royalty interests in natural resources, mostly energy, and sends a large share of its cash flow back to shareholders as dividends.

Income investors often like these stocks because they can offer high yields tied to production and commodity prices. They also tend to need less capital spending than traditional operators.

So what does this dividend increase really say about AMEN's appeal and the staying power of its income story? Let's dive in.

AMEN's Financial Footing

AMEN Properties is based in Dallas, Texas, and focuses on oil and gas royalty and working interests. It uses a tight portfolio of mineral and leasehold assets to turn commodity exposure into steady, high‑margin cash for shareholders.

Its board has approved a quarterly dividend of $12.50 per share, payable on July 7 to shareholders of record on June 30. This new payout annualizes to about $50.00 per share and implies a yield around 10% at recent prices.

AMEN stock trades around $512 as of early June 23, with a year‑to‑date (YTD) gain of 1.39% and a 52‑week gain of 2.40% in the over‑the‑counter market.www.barchart.com

This is still a relatively small company with an equity value of only $27.17 million. It trades at 11.20x price‑to‑sales and 13.70x price‑to‑cash‑flow versus sector medians of 1.61x and 6.54x, which shows investors are paying a clear premium for its royalty‑heavy model.

Their June 15 release covering results for the first quarter ended March 31 gave more context around the dividend move. It showed oil and gas revenue of $599,635 and net income of $2.6 million for the period, a sharp shift in earnings power.

Story Continues

The update compared those figures with revenue of $728,294 and net income of $240,334 in the first quarter of 2025. That contrast points to a year‑over‑year (YoY) decline in revenue but a more than tenfold jump in profit, highlighting how much the bottom line has changed.

Properties Leasehold Deals

AMEN's dividend bump is tied directly to a clear jump in earnings, and that jump came from a specific deal rather than just higher royalty income. Their first quarter of 2026 saw profits rise sharply after the company sold and assigned some leasehold interests.

This transaction brought in about $2.3 million in proceeds, which gave a noticeable lift to the bottom line and increased the cash available to pay out. The new, higher dividend is now supported by both ongoing royalty cash flow and this one‑off asset sale.

AMEN's Limited Analysts Coverage

AMEN Properties sits in a part of the market with very little mainstream research, as earnings estimates are not available. Analyst ratings are also not available for AMEN. Due to its micro‑cap status and OTC trading, AMEN receives very limited attention from traditional Wall Street analysts. That absence of ratings and forward estimates makes independent research essential.

Conclusion

AMEN's 25% dividend hike looks largely supported by its royalty cash flows, but the extra lift from recent asset sales means the new payout still needs to be tested over time. Income-focused investors will likely keep the stock moving sideways to slightly higher as long as the dividend is covered and the balance sheet stays in good shape. In the long run, how the dividend trend evolves, more than short-term price moves, will probably decide whether this high-yield name ends up being worth the risk.

On the date of publication, Ebube Jones did not have (either directly or indirectly) positions in any of the securities mentioned in this article. All information and data in this article is solely for informational purposes. This article was originally published on Barchart.com

View Comments",https://finance.yahoo.com/markets/stocks/articles/amen-properties-just-announced-25-233002685.html,"['AMEN.US', 'AVGO.US', 'DELL.US', 'FDX.US', 'HEI.US', 'MA.US']","['BALANCE SHEET', 'DIVIDENDS', 'EARNINGS', 'HIGH-YIELD', 'NET INCOME', 'RATINGS', 'SHAREHOLDER']",0.993,0.012,0.899,0.089
AVGO.US,2026-06-23T22:32:46+00:00,"Broadcom (AVGO) Stock Trades Down, Here Is Why","What Happened?

Shares of fabless chip and software maker Broadcom (NASDAQ:AVGO) fell 2.9% in the afternoon session after a report that South Korea's SK Hynix is slowing its high-bandwidth memory (HBM) expansion rattled the AI-chip complex.

The headline sounds bearish for AI, but the underlying report is a margin story, not a demand story. SK Hynix is deliberately slowing its HBM4 ramp to redirect capacity into conventional DRAM, where shortages have pushed operating margins above HBM's. Korean analysts pegged the margin gap at more than 15 points.

HBM is the memory bolted onto Nvidia's AI accelerators, so any ""slowing HBM"" signal instinctively sparks fears the AI build-out is cooling which is why the reflex was to sell. The more accurate read is that all three memory makers are running the market tight (Samsung flagged a 146% DRAM ASP jump in Q1, SK Hynix mid-60%), keeping pricing power with sellers.

The bigger driver appeared like profit-taking after a parabolic run. Micron rose ~300% since the start of the year, colliding with a hawkish rate shift: traders pricing 50bps of Fed hikes by December under new Chair Kevin Warsh, making debt-funded AI capex harder to justify at record valuations. The divergence confirmed it: memory names took the brunt (Micron −11%) while logic-heavy Nvidia fell only ~3.6%. Wedbush framed the drop as a buying opportunity with enterprise demand intact.

The shares closed the day at $380.10, down 3.3% from the previous close.

The stock market overreacts to news, and big price drops can present good opportunities to buy high-quality stocks. Is now the time to buy Broadcom? Access our full analysis report here, it's free.

What Is The Market Telling Us

Broadcom's shares are quite volatile and have had 16 moves greater than 5% over the last year. In that context, today's move indicates the market considers this news meaningful but not something that would fundamentally change its perception of the business.

The previous big move we wrote about was 12 days ago when the stock gained 3.3% on the news that the Nasdaq rebounded, up 1.8%, as Trump's Iran peace deal announcement released the rate pressure that weighed on the sector all week.

Semiconductor stocks trade at elevated multiples on future earnings, making them disproportionately sensitive to interest rates. Oil falling more than 3% and the 10-year Treasury yield dropping to 4.47% released the rate hike pressure that drove the sector's worst week since 2020. The structural AI demand story never broke: Intel's BofA double upgrade to $135 earlier in the day confirmed hyperscalers are placing real production orders at domestic foundries, and AI infrastructure capex commitments remained intact.

Story Continues

Broadcom is up 9.9% since the beginning of the year, but at $382.04 per share, it is still trading 20.7% below its 52-week high of $481.57 from June 2026. Investors who bought $1,000 worth of Broadcom's shares 5 years ago would now be looking at an investment worth $8,187.

ONE MORE THING: 3 Hidden Platforms Growing 3X Faster than Amazon, Google, and PayPal. Amazon, Google, and Meta all followed the same playbook: Dominate an ignored market. Build an unbeatable moat. Scale until you're unstoppable.

These three platforms are running that exact playbook right now. The early investors in Amazon made fortunes. The early investors in these could do the same. Get All 3 Stocks Here for FREE.

View Comments",https://finance.yahoo.com/markets/stocks/articles/broadcom-avgo-stock-trades-down-223246211.html,"['005930.KS', '005935.KS', '1YD.DU', '1YD.F', '1YD.HA', '1YD.HM', '1YD.MU', 'AVGO.US', 'AVGO34.SA', 'NVDA.US', 'SMSNN.MX', 'SSNLF.US', 'SSU.F', 'SSUN.F']","['AI', 'MEMORY', 'RATE-HIKES', 'SEMICONDUCTORS', 'TREASURIES']",0.989,0.061,0.815,0.124
AVGO.US,2026-06-23T21:03:00+00:00,These stocks in the S&amp;P 500 fell the most on Tuesday as the tech sector came under pressure,"Sandisk's stock was the worst performer among the S&P 500 on June 23 — but it was still up 727% for 2026. - Getty Images

Broad U.S. stock indexes were all down on Tuesday, with tech-hardware stocks seeing especially sharp pullbacks.

The S&P 500 SPX declined 1.4%, while its information-technology sector XX:SP500.45 was down 3.7%.

Most Read from MarketWatch

Is Wendy's the next meme stock? Everyday traders are trying to 'save' the fast-food chain. 'We are habitually frugal': My wife and I have money. How do we help our children without ruining their independence?

Digging further into tech, the iShares Semiconductor ETF SOXX was down 7.9% on the day. This exchange-traded fund holds 30 stocks tracking the PHLX Semiconductor Index SOX — and all of them declined on Tuesday.

Granted, it is worth putting those performances into perspective. The S&P 500's IT sector was still up 16.6% for 2026, while the SOXX was still up 100.4% on the year.

Here were the day's worst performers among the S&P 500, based on data provided by LSEG:

Company June 23 price change June price change 2026 price change 2025 price change Sandisk SNDK -13.6% 15.8% 727.2% N/A Micron Technology MU -13.2% 8.3% 268.5% 239.1% Vertiv Holdings VRT -11.1% 0.8% 96.5% 42.6% ON Semiconductor ON -11.0% -3.0% 116.2% -14.1% Coherent COHR -10.4% 5.5% 106.5% 94.8% Marvell Technology MRVL -9.4% 36.1% 228.4% -23.1% Lam Research LRCX -9.3% 16.7% 116.9% 137.0% Microchip Technology MCHP -9.2% -1.5% 46.4% 11.1% KLA KLAC -9.2% 27.2% 101.2% 92.8% Analog Devices ADI -8.6% -1.6% 50.2% 27.6% Applied Materials AMAT -8.5% 30.2% 128.0% 58.0% Western Digital WDC -8.4% 26.3% 289.4% 282.3% Texas Instruments TXN -8.4% -0.4% 75.4% -7.5% Qnity Electronics Q -8.2% 3.3% 97.4% N/A GE Vernova GEV -8.2% 6.9% 58.4% 98.7% Teradyne TER -8.1% 12.2% 117.0% 53.7% Qualcomm AVGO -8.0% -18.7% 19.3% 11.3% Comfort Systems USA FIX -7.7% 4.4% 104.4% 120.1% Corning GLW -7.5% 7.1% 121.6% 84.3% Monolithic Power Systems MPWR -7.4% -9.1% 57.1% 53.2% Source: LSEG

The S&P 500's largest decliners on Tuesday — Sandisk SNDK and Micron MU — both manufacture memory chips and related hardware. These stocks were still up for June and were showing triple-digit year-to-date gains.

The high volatility during Tuesday's trading session could wind up being a momentary blip as the infrastructure buildout to support generative artificial intelligence continues.

Micron reports earnings on Wednesday afternoon. That will mark a key test for the semiconductor sector.

Isabel Wang: Are falling tech stocks the start of an overdue selloff — or a well-deserved pause?

Most Read from MarketWatch

SpaceX pulls off one of the biggest AI debt deals yet

View Comments",https://finance.yahoo.com/markets/stocks/articles/stocks-p-500-fell-most-210300252.html,"['ADI.US', 'AMAT.US', 'AVGO.US', 'COHR.US', 'GLW.US', 'GSPC.INDX', 'KLAC.US', 'LRCX.US', 'MCHP.US', 'MRVL.US', 'MU.US', 'SNDK.US', 'SOX.INDX', 'SOXX.US', 'SP500.45', 'TER.US', 'TXN.US', 'WDC.US']","['EARNINGS', 'SEMICONDUCTORS', 'TECH']",0.877,0.029,0.917,0.054
AVGO.US,2026-06-23T19:45:48+00:00,The highest paid CEOs of 2025: Elon Musk makes the top spot,"Yahoo Finance Senior Reporters Brooke DiPalma and Ines Ferré come on Market Domination to cover several of the day's biggest stories, including listing off the top-paid CEOs who made over $200 million in 2025. This includes Tesla (TSLA) CEO Elon Musk and Broadcom (AVGO) chief executive Hock Tan.

Video Transcript

00:01 Speaker A

I'll go to you first, Brooke.

00:02 Brooke

Mhm.

00:02 Speaker A

The journal is saying here, the $100 million plus CEO is back.

00:07 Brooke

Yes.

00:08 Speaker A

More US CEOs they say last year crossed that pay threshold than in any year since 2021. Nearly a dozen top 200 million. It's good to be the king. What do you mean?

00:20 Brooke

Good to be the king. I was looking at this a little bit closer. Some of the charts that this company of that uh the journal I believe posted this had provided. And I mean you're looking at a mix of both cash and equity. So don't necessarily think that this is like a complete cash payout and they're going to go buy a million- dollar mansion. A lot of this is tied with equity. In fact, most of these high-paid uh S&P 500 CEOs are have their wealth tied up in equity, including, you know, Warner Brother's executive, David Zasla. You have Blackstone, Goldman Sachs CEO, uh City Group CEO, Wells Fargo CEO, just to name a few. You can see there, most of those on your screen are a large portion of it is mixed with equity, not just a cash bundle offering here.

01:05 Speaker A

Leave that up on the screen, producers, because Ines, here's the thing. All right, Elon Musk, no one is surprised by seeing rocket man on this list. I mean, but Musk is in like a category of his own. I don't know if a lot of viewers would expect a real estate investment trust focused on senior housing to be near the top, but there he is, the CEO of Well Tower reached 821 million? Not too shabby, Ines.

01:31 Ines

No, not too shabby at all. That's huge. And also the overall medium CEO pay, that rose to 18 million. That's like chump change compared to that that figure, but still, for most people, it's not chump change. I mean 18 million for that medium for the CEO in 2025. Look, uh this talks to the to how much uh companies value leadership and also tie to that compensation, stock-based compensation. And and if you look at the markets, I mean at all-time highs. This is a moonshot.

02:07 Speaker A

See that's it. Do you do you do you think a lot of this is boards getting more comfortable with these big comp packages because the markets are working?

02:14 Brooke

Because they want the stock to go up. They want it to be tied to this. We've even seen this happen at Starbucks for example. They tied a lot of executive compensation packages there to the stock. They want to see that stock go up, they want to see a return. and if it returns, then guess what? These executives are getting paid higher. So that's what they want too.

View Comments",https://finance.yahoo.com/video/highest-paid-ceos-2025-elon-194548748.html,"['AVGO.US', 'SBUB34.SA', 'SBUX.MX', 'SBUX.US', 'SRB.F', 'SRB.HM', 'SRB.MU', 'TSLA.US']","['CEO-COMPENSATION', 'EQUITY-COMPENSATION']",0.99,0.017,0.888,0.095
AVGO.US,2026-06-23T16:56:46+00:00,A Look Back at Processors and Graphics Chips Stocks’ Q1 Earnings: Broadcom (NASDAQ:AVGO) Vs The Rest Of The Pack,"A Look Back at Processors and Graphics Chips Stocks' Q1 Earnings: Broadcom (NASDAQ:AVGO) Vs The Rest Of The Pack

As the Q1 earnings season wraps, let's dig into this quarter's best and worst performers in the processors and graphics chips industry, including Broadcom (NASDAQ:AVGO) and its peers.

The biggest demand drivers for processors (CPUs) and graphics chips at the moment are secular trends related to 5G and Internet of Things, autonomous driving, and high performance computing in the data center space, specifically around AI and machine learning. Like all semiconductor companies, digital chip makers exhibit a degree of cyclicality, driven by supply and demand imbalances and exposure to PC and Smartphone product cycles.

The 9 processors and graphics chips stocks we track reported a very strong Q1. As a group, revenues beat analysts' consensus estimates by 2.9% while next quarter's revenue guidance was 4.2% above.

Luckily, processors and graphics chips stocks have performed well with share prices up 56.9% on average since the latest earnings results.

Broadcom (NASDAQ:AVGO)

Originally the semiconductor division of Hewlett Packard, Broadcom (NASDAQ:AVGO) is a semiconductor conglomerate spanning wireless communications, networking, and data storage as well as infrastructure software focused on mainframes and cybersecurity.

Broadcom reported revenues of $22.19 billion, up 47.9% year on year. This print exceeded analysts' expectations by 0.6%. Overall, it was a satisfactory quarter for the company with revenue guidance for next quarter beating analysts' expectations but an increase in its inventory levels.

""Broadcom achieved record revenue, operating profit and free cash flow in Q2 driven by accelerating growth in AI semiconductor revenue and strong operating leverage. Q2 semiconductor revenue from AI of $10.8 billion grew 143% year-over-year, above our forecast, driven by increasing demand for custom AI accelerators and AI networking,"" said Hock Tan, President and CEO of

Even though it had a relatively good quarter, the market seems discontent with the results. The stock is down 18.1% since reporting and currently trades at $392.49.

Is now the time to buy Broadcom? Access our full analysis of the earnings results here, it's free.

Best Q1: Lattice Semiconductor (NASDAQ:LSCC)

A global leader in its category, Lattice Semiconductor (NASDAQ:LSCC) is a semiconductor designer specializing in customer-programmable chips that enhance CPU performance for intensive tasks such as machine learning.

Lattice Semiconductor reported revenues of $170.9 million, up 42.2% year on year, outperforming analysts' expectations by 3.6%. The business had a stunning quarter with a significant improvement in its inventory levels and a beat of analysts' EPS estimates.

Story Continues

The market seems happy with the results as the stock is up 23.8% since reporting. It currently trades at $155.45.

Is now the time to buy Lattice Semiconductor? Access our full analysis of the earnings results here, it's free.

Slowest Q1: Qualcomm (NASDAQ:QCOM)

Having been at the forefront of developing the standards for cellular connectivity for over four decades, Qualcomm (NASDAQ:QCOM) is a leading innovator and a fabless manufacturer of wireless technology chips used in smartphones, autos and internet of things appliances.

Qualcomm reported revenues of $10.6 billion, down 2.2% year on year, in line with analysts' expectations. It was a slower quarter as it posted revenue guidance for next quarter missing analysts' expectations and an increase in its inventory levels.

Qualcomm delivered the weakest performance against analyst estimates and weakest guidance update in the group. Interestingly, the stock is up 41.5% since the results and currently trades at $220.70.

Read our full analysis of Qualcomm's results here.

Intel (NASDAQ:INTC)

Inventor of the x86 processor that powered decades of technological innovation in PCs, data centers, and numerous other markets, Intel (NASDAQ:INTC) is a leading manufacturer of computer processors and graphics chips.

Intel reported revenues of $13.58 billion, up 7.2% year on year. This result surpassed analysts' expectations by 9.6%. Overall, it was an exceptional quarter as it also produced a beat of analysts' EPS and operating income estimates.

Intel scored the biggest analyst estimate beat and highest guidance raise among its peers. The stock is up 108% since reporting and currently trades at $139.00.

Read our full, actionable report on Intel here, it's free.

AMD (NASDAQ:AMD)

Founded in 1969 by a group of former Fairchild semiconductor executives led by Jerry Sanders, Advanced Micro Devices (NASDAQ:AMD) is one of the leading designers of computer processors and graphics chips used in PCs and data centers.

AMD reported revenues of $10.25 billion, up 37.8% year on year. This print beat analysts' expectations by 3.6%. It was an exceptional quarter as it also recorded revenue guidance for next quarter exceeding analysts' expectations and a beat of analysts' EPS estimates.

The stock is up 53.9% since reporting and currently trades at $546.80.

Read our full, actionable report on AMD here, it's free.

Market Update

Late in 2025 into early 2026, there was hand-wringing around artificial intelligence. For software companies, the fear was that AI would erode pricing power and compress margins as new tools made it easier to replicate what once required expensive enterprise platforms. Crypto investors had their own version of the same anxiety: if AI agents could trade, allocate capital, and manage wallets autonomously, what exactly was the long-term value of today's crypto infrastructure?

These concerns triggered a noticeable rotation away from these sectors and into safer havens. But markets rarely dwell on one narrative for long. Spring 2026 came, and the focus shifted abruptly from technological disruption to geopolitical risk. The US' conflict with Iran became the dominant driver of market psychology, and when geopolitics takes center stage, the script changes quickly. Investors stop debating growth rates and start worrying about oil supply, inflation, and global stability.

Want to invest in winners with rock-solid fundamentals? Check out our Hidden Gem Stocks and add them to your watchlist. These companies are poised for growth regardless of the political or macroeconomic climate.

StockStory's analyst team — all seasoned professional investors — uses quantitative analysis and automation to deliver market-beating insights faster and with higher quality.

View Comments",https://finance.yahoo.com/markets/stocks/articles/look-back-processors-graphics-chips-165646145.html,"['1YD.DU', '1YD.F', '1YD.HA', '1YD.HM', '1YD.MU', 'AMD.US', 'AVGO.US', 'AVGO34.SA', 'INTC.US', 'LSCC.US', 'QCOM.US']","['AI', 'EARNINGS', 'EARNINGS RESULTS', 'FREE CASH FLOW', 'MARKET-UPDATE', 'OPERATING INCOME', 'SEMICONDUCTORS', 'TECHNOLOGY']",0.998,0.04,0.85,0.11
