query_ticker,date,title,content,link,symbols,tags,sentiment.polarity,sentiment.neg,sentiment.neu,sentiment.pos
AVGO.US,2026-06-19T12:16:00+00:00,Micron Likely to Beat Q3 Earnings Estimates: Time to Buy the Stock?,"Micron Technology, Inc. MU will report third-quarter fiscal 2026 results after market close on June 24.

The company projects fiscal third-quarter revenues to be $35.5 billion (+/- $750 million). The Zacks Consensus Estimate for the top line is pegged at $34.8 billion, which implies year-over-year growth of 274.2%.

Micron Technology estimates adjusted earnings of $19.15 (+/-40 cents). The consensus mark for the bottom line has been revised upward by 38 cents to $19.72 per share over the past 30 days, which indicates a year-over-year improvement of 932.5%.Zacks Investment Research

Image Source: Zacks Investment Research

The company's earnings surpassed the Zacks Consensus Estimate in each of the trailing four quarters, the average surprise being 21.74%.

Micron Technology, Inc. Price and EPS Surprise

Micron Technology, Inc. price-eps-surprise | Micron Technology, Inc. Quote

Earnings Whispers for Micron Technology

Our proven model predicts an earnings beat for Micron Technology this earnings season. The combination of a positive Earnings ESP and a Zacks Rank #1 (Strong Buy), 2 (Buy) or 3 (Hold) increases the chances of an earnings beat, which is the case here.

MU's Earnings ESP: Earnings ESP, which represents the difference between the Most Accurate Estimate ($20.87 per share) and the Zacks Consensus Estimate ($19.72 per share), is +5.81%. You can uncover the best stocks to buy or sell before they are reported with our Earnings ESP Filter.

MU's Zacks Rank: Micron Technology sports a Zacks Rank #1. You can see the complete list of today's Zacks #1 Rank stocks here.

Factors Likely to Influence Micron's Q3 Results

Micron Technology's third-quarter results are poised to reflect a significant boost from the growing demand for memory chips, fueled by the increasing adoption of graphics processing unit (GPU)-enabled artificial intelligence (AI) servers. As data center operators expand their infrastructure to support generative AI and large language models, memory chips have become essential components. This surge in demand for AI-driven technologies is likely to have bolstered Micron Technology's revenues during the quarter under review.

Another positive factor is the improving supply-demand dynamics in the memory chip market. For several quarters, MU faced headwinds from excess inventory across various sectors, which heavily impacted its financial results. However, conditions have improved over the past year, which has resulted in improvements in prices for its DRAM chips. According to the Zacks Consensus Estimate, DRAM revenues for the third quarter are expected to hit $26.27 billion, indicating robust year-over-year growth of 271.6%.

Story Continues

Micron Technology has achieved an industry-first ramp-up of 1β DRAM, HBM3E and 232-layer/368-layer NAND, positioning it strongly for next-generation demand in the third quarter of fiscal 2026. MU is also benefiting from the improving memory pricing environment, driven by industry discipline, supply tightening and a richer product mix.

However, inflationary pressures and macroeconomic uncertainties have dampened consumer spending, likely reducing demand for memory chips in key markets, such as smartphones and personal computers. Micron Technology's heavy reliance on China poses a risk amid ongoing U.S.-China trade tensions.

Micron Technology Share Price Performance

Over the past year, Micron Technology shares have surged 835.3%, outperforming the Zacks Computer – Integrated Systems industry's rise of 244.9%. The stock has also outpaced major semiconductor companies, including Taiwan Semiconductor Manufacturing TSM, Broadcom AVGO and NVIDIA NVDA. Shares of Taiwan Semiconductor Manufacturing, Broadcom and NVIDIA have rallied 116.8%, 63.8% and 44.5%, respectively.

Micron Technology One-Year Price Return PerformanceZacks Investment Research

Image Source: Zacks Investment Research

From a valuation standpoint, MU appears to be trading at a discount relative to the industry and is trading well below its mean. Going by the forward 12-month price-to-earnings (P/E) ratio, the company's shares currently trade at 11.75, significantly lower than 18.34 for the industry.

Micron Technology Forward 12-Month P/E RatioZacks Investment Research

Image Source: Zacks Investment Research

MU stock also trades at a discounted multiple compared to Broadcom, NVIDIA and Taiwan Semiconductor Manufacturing. At present, Broadcom, NVIDIA and Taiwan Semiconductor Manufacturing have P/S multiples of 27.12, 25.07 and 20.74, respectively.

Investment Consideration for MU Stock

Micron Technology sits at the heart of several transformative tech trends. The company's exposure to AI, high-performance data centers, autonomous vehicles and industrial IoT uniquely positions it for sustainable long-term growth. As AI adoption accelerates, the demand for advanced memory solutions like DRAM and NAND is soaring. Micron Technology's investments in next-generation DRAM and 3D NAND ensure it remains competitive in delivering the performance needed for modern computing.

The company's diversification strategy is also bearing fruit. Micron Technology has created a more stable revenue base by shifting its focus from the more volatile consumer electronics market toward resilient verticals such as automotive and enterprise IT.

Micron Technology is also riding on a strong wave of high-bandwidth memory (HBM) demand. Its HBM3E and HBM4 products are attracting significant interest due to their superior energy efficiency and bandwidth, which are ideal for AI workloads. The continuously evolving new tech trends and diversification strategy are likely to aid MU's growth over the long run.

Conclusion: Buy Micron Technology Stock for Now

Micron Technology's fundamentals remain strong, and its position in the AI-driven memory market is well-established. The company offers compelling long-term growth potential, maintains a disciplined approach to innovation and trades at a discount relative to peers. Considering these factors, it is prudent to accumulate MU stock ahead of its third-quarter fiscal 2026 results.

Want the latest recommendations from Zacks Investment Research? Today, you can download 7 Best Stocks for the Next 30 Days. Click to get this free report

Micron Technology, Inc. (MU) : Free Stock Analysis Report

NVIDIA Corporation (NVDA) : Free Stock Analysis Report

Broadcom Inc. (AVGO) : Free Stock Analysis Report

Taiwan Semiconductor Manufacturing Company Ltd. (TSM) : Free Stock Analysis Report

This article originally published on Zacks Investment Research (zacks.com).

Zacks Investment Research

View Comments",https://finance.yahoo.com/markets/stocks/articles/micron-likely-beat-q3-earnings-121600606.html,"['1MU.MI', '2330.TW', 'AVGO.US', 'MTE.F', 'MU.MX', 'MU.US', 'MUTC34.SA', 'NVDA.US', 'TSFA.F', 'TSM.US', 'TSMC34.SA', 'TSMN.MX']","['AI', 'EARNINGS', 'FINANCIAL RESULTS', 'MEMORY-CHIPS', 'SEMICONDUCTORS', 'TECH']",0.999,0.02,0.827,0.154
AVGO.US,2026-06-19T11:26:00+00:00,SpaceX Has a Rapidly Approaching $20 Billion Surprise for Its Shareholders -- and They're Not Going to Be Happy,"Key Points

Elon Musk's artificial intelligence (AI) and space infrastructure goliath entered the record books on June 12 by raising $75 billion from its IPO. SpaceX has a $20 billion bridge loan that matures as early as Sept. 2, 2027, which will eat up a substantial portion of its capital raise.  Additionally, SpaceX's prospectus points to future debt and equity issuances that threaten to dilute retail investors. 10 stocks we like better than Space Exploration Technologies ›

One week ago today, Space Exploration Technologies (SpaceX) (NASDAQ: SPCX) made history. The $75 billion raised from its initial public offering (IPO) handily unseated Saudi Aramco's $29.4 billion IPO cash raise in December 2019.

Additionally, it took just three trading days for SpaceX's market cap to blow past Tesla, Meta Platforms, Broadcom, and even Amazon. Its $2.66 trillion valuation on June 16 gives SpaceX meaningful influence within the Nasdaq Composite.

Where to invest $1,000 right now? Our analyst team just revealed what they believe are the 10 best stocks to buy right now, when you join Stock Advisor. See the stocks »

Several factors have played a role in SpaceX's parabolic ascent, including:

Retail investor euphoriaNew fast-entry index inclusion rules for the Nasdaq-100 and U.S. Russell IndexesIts historically low floatIts focus on two of the hottest investment trends: artificial intelligence (AI) and the space economy

Image source: Getty Images.

But investors might be surprised to learn that SpaceX's IPO isn't all it's cracked up to be. Contained within its mile-long prospectus is a $20 billion surprise that's rapidly approaching.

Elon Musk is using retail investors' capital to pay off non-space-related loans

When SpaceX raised $75 billion by going public, investors were almost certainly under the impression that this capital would be used to further its reusable launch vehicle, Starship; build and launch new satellites for space-based broadband service, Starlink; expand xAI's data center infrastructure; and make acquisitions.

But what if I told you that $20 billion of SpaceX's $75 billion capital raise was already spoken for... and that it had nothing to do with the company's space-related operations.

In March 2026, just a month after merging with AI start-up xAI, SpaceX entered into a $20 billion bridge loan agreement with a consortium of banks. The company's prospectus notes that this $20 billion was used to repay two separate term loans for social media platform X, an xAI fixed-rate term loan, an xAI floating-rate loan, and an xAI 12.5% secured senior note. The icing on the cake is that Musk's company paid $1.163 billion in prepayment penalties.

Oh, I forgot the best part.

Months before the IPO, SpaceX took $17.5 billion of old junk debt from xAI and X and parked it on its own balance sheet through a $20 billion bridge loan.

The terms? Repaid within six months of listing.

So part of the $75 billion that retail and... https://t.co/6FRaZU8W8q -- Thierry from arvy 🇨🇭 (@ThierryBorgeat) June 16, 2026

Bridge loans are inherently short-term. SpaceX's bridge loan is scheduled to mature on Sept. 2, 2027, with a company option for up to two three-month extensions. Either way, SpaceX owes $20 billion to this syndicate of banks by Sept. 2, 2027, Dec. 2, 2027, or March 2, 2028, at the latest.

In other words, that's 27% of the cash raised from SpaceX's IPO being used to pay back preexisting loans for Elon Musk's other companies.

Just in case this isn't enough of a kick in the pants for retail investors, SpaceX's ""Capital Allocation and Funding Strategy"" from its prospectus plainly states:

We plan to access a range of debt and equity financing solutions available to us as a public company to fund future investments in growth and to maintain strong liquidity.

Given that SpaceX isn't close to recurring profitability and has $20 billion of its capital raise already spoken for, its prospectus makes it abundantly clear that share-based dilution is on the way. In the event that SpaceX's staggered lockup schedule doesn't fleece investors, share-based dilution to scale xAI's compute capabilities should do the trick.

The list of reasons for retail investors to avoid SpaceX is growing.

Should you buy stock in Space Exploration Technologies right now?

Before you buy stock in Space Exploration Technologies, consider this:

The Motley Fool Stock Advisor analyst team just identified what they believe are the 10 best stocks for investors to buy now… and Space Exploration Technologies wasn’t one of them. The 10 stocks that made the cut could produce monster returns in the coming years.

Consider when Netflix made this list on December 17, 2004... if you invested $1,000 at the time of our recommendation, you’d have $415,040!* Or when Nvidia made this list on April 15, 2005... if you invested $1,000 at the time of our recommendation, you’d have $1,256,076!*

Now, it’s worth noting Stock Advisor’s total average return is 920% — a market-crushing outperformance compared to 207% for the S&P 500. Don't miss the latest top 10 list, available with Stock Advisor, and join an investing community built by individual investors for individual investors.

See the 10 stocks »

*Stock Advisor returns as of June 19, 2026.

Sean Williams has positions in Amazon and Meta Platforms. The Motley Fool has positions in and recommends Amazon, Broadcom, Meta Platforms, and Tesla. The Motley Fool has a disclosure policy.

The views and opinions expressed herein are the views and opinions of the author and do not necessarily reflect those of Nasdaq, Inc.",https://www.nasdaq.com/articles/spacex-has-rapidly-approaching-20-billion-surprise-its-shareholders-and-theyre-not-going,"['AMZN.US', 'AVGO.US', 'META.US', 'NVDA.US', 'SPCX.US', 'TSLA.US']","['BALANCE SHEET', 'DEBT', 'INITIAL PUBLIC OFFERING', 'IPO', 'MARKETS', 'NASDAQ', 'RETAIL-INVESTORS', 'SHARE-BUYBACK']",0.994,0.031,0.875,0.095
AVGO.US,2026-06-19T11:26:00+00:00,SpaceX Has a Rapidly Approaching $20 Billion Surprise for Its Shareholders -- and They're Not Going to Be Happy,"One week ago today, Space Exploration Technologies (SpaceX) (NASDAQ: SPCX) made history. The $75 billion raised from its initial public offering (IPO) handily unseated Saudi Aramco's $29.4 billion IPO cash raise in December 2019.

Additionally, it took just three trading days for SpaceX's market cap to blow past Tesla, Meta Platforms, Broadcom, and even Amazon. Its $2.66 trillion valuation on June 16 gives SpaceX meaningful influence within the Nasdaq Composite.

Missed Nvidia in 2009? This Rare Signal Is Flashing Again. In 2009, a ""Double Down"" signal flashed for a little-known chipmaker called Nvidia. For the first time in years, that same ""Total Conviction"" signal is flashing for a company 1/100th the size of Nvidia. Continue »

Several factors have played a role in SpaceX's parabolic ascent, including:

Retail investor euphoria New fast-entry index inclusion rules for the Nasdaq-100 and U.S. Russell Indexes Its historically low float Its focus on two of the hottest investment trends: artificial intelligence (AI) and the space economyImage source: Getty Images.

But investors might be surprised to learn that SpaceX's IPO isn't all it's cracked up to be. Contained within its mile-long prospectus is a $20 billion surprise that's rapidly approaching.

Elon Musk is using retail investors' capital to pay off non-space-related loans

When SpaceX raised $75 billion by going public, investors were almost certainly under the impression that this capital would be used to further its reusable launch vehicle, Starship; build and launch new satellites for space-based broadband service, Starlink; expand xAI's data center infrastructure; and make acquisitions.

But what if I told you that $20 billion of SpaceX's $75 billion capital raise was already spoken for... and that it had nothing to do with the company's space-related operations.

In March 2026, just a month after merging with AI start-up xAI, SpaceX entered into a $20 billion bridge loan agreement with a consortium of banks. The company's prospectus notes that this $20 billion was used to repay two separate term loans for social media platform X, an xAI fixed-rate term loan, an xAI floating-rate loan, and an xAI 12.5% secured senior note. The icing on the cake is that Musk's company paid $1.163 billion in prepayment penalties.

Bridge loans are inherently short-term. SpaceX's bridge loan is scheduled to mature on Sept. 2, 2027, with a company option for up to two three-month extensions. Either way, SpaceX owes $20 billion to this syndicate of banks by Sept. 2, 2027, Dec. 2, 2027, or March 2, 2028, at the latest.

Story Continues

In other words, that's 27% of the cash raised from SpaceX's IPO being used to pay back preexisting loans for Elon Musk's other companies.

Just in case this isn't enough of a kick in the pants for retail investors, SpaceX's ""Capital Allocation and Funding Strategy"" from its prospectus plainly states:

We plan to access a range of debt and equity financing solutions available to us as a public company to fund future investments in growth and to maintain strong liquidity.

Given that SpaceX isn't close to recurring profitability and has $20 billion of its capital raise already spoken for, its prospectus makes it abundantly clear that share-based dilution is on the way. In the event that SpaceX's staggered lockup schedule doesn't fleece investors, share-based dilution to scale xAI's compute capabilities should do the trick.

The list of reasons for retail investors to avoid SpaceX is growing.

Should you buy stock in Space Exploration Technologies right now?

Before you buy stock in Space Exploration Technologies, consider this:

The Motley Fool Stock Advisor analyst team just identified what they believe are the 10 best stocks for investors to buy now… and Space Exploration Technologies wasn't one of them. The 10 stocks that made the cut could produce monster returns in the coming years.

Consider when Netflix made this list on December 17, 2004... if you invested $1,000 at the time of our recommendation, you'd have $415,040!* Or when Nvidia made this list on April 15, 2005... if you invested $1,000 at the time of our recommendation, you'd have $1,256,076!*

Now, it's worth noting Stock Advisor's total average return is 920% — a market-crushing outperformance compared to 207% for the S&P 500. Don't miss the latest top 10 list, available with Stock Advisor, and join an investing community built by individual investors for individual investors.

See the 10 stocks »

*Stock Advisor returns as of June 19, 2026.

Sean Williams has positions in Amazon and Meta Platforms. The Motley Fool has positions in and recommends Amazon, Broadcom, Meta Platforms, and Tesla. The Motley Fool has a disclosure policy.

SpaceX Has a Rapidly Approaching $20 Billion Surprise for Its Shareholders -- and They're Not Going to Be Happy was originally published by The Motley Fool

View Comments",https://finance.yahoo.com/markets/stocks/articles/spacex-rapidly-approaching-20-billion-112600929.html,"['2222.SR', 'AMZN.US', 'AVGO.US', 'META.US', 'NVDA.US', 'SPCX.US', 'TSLA.US']","['DEBT-FINANCING', 'INITIAL PUBLIC OFFERING', 'INVESTMENT-TRENDS', 'IPO', 'SHARE-DILUTION', 'SPACE-ECONOMY']",0.992,0.032,0.874,0.094
AVGO.US,2026-06-19T10:25:00+00:00,3 AI Stocks to Buy on the Recent Tech Dip,"Key Points

Broadcom has a huge custom-chip opportunity. Amazon is just hitting its stride as a leader in e-commerce and cloud computing. ServiceNow looks poised to be a leader in agentic AI orchestration. 10 stocks we like better than Broadcom ›

After a huge run this spring, the tech sector took a breather, giving back some of its big gains. During this pullback, several artificial intelligence (AI) stocks were hit harder than others. However, many of these stocks look well positioned for the long term and are strong rebound candidates.

Let's look at three AI stocks that were overly punished and could be great buys for the long haul.

Where to invest $1,000 right now? Our analyst team just revealed what they believe are the 10 best stocks to buy right now, when you join Stock Advisor. See the stocks »

Image source: Getty Images.

1. Broadcom: A huge custom chip and networking opportunity

Broadcom(NASDAQ: AVGO) not only got swept up in the recent tech sell-off, but investors also sold off the stock after the company didn't raise its fiscal 2027 outlook for AI chip revenue. Broadcom is still in the middle of its fiscal 2026 year, so there was no need to be pushing up this number so soon.

Nonetheless, the company has a huge AI opportunity. It's one of the go-to businesses to help hyperscalers develop custom AI accelerators.

Broadcom is currently riding the wave of Alphabet's success with its tensor processing units (TPUs), which it co-developed, and the huge amount it is spending on AI infrastructure. Broadcom projects its AI chip revenue will exceed $100 billion next fiscal year, which is more than the $64 billion in total revenue it generated in fiscal 2025.

The company is also a leader in co-packaged optics and data center networking, which feed directly into its custom chip business. With such a huge opportunity, this is a stock you want to pick up on this dip.

2. Amazon: The e-commerce and cloud leader

Amazon(NASDAQ: AMZN) was another stock that took a hit in the recent tech sell-off. However, this is a company that is just starting to really hit its stride.

In its e-commerce business, the company is seeing tremendous operating leverage with investments in AI and robotics. In the retail space, Amazon is far ahead in these areas, and it is really helping drive efficiencies and cost savings, which are leading to strong profit growth. This is an underappreciated part of its story, and the company doesn't get nearly enough credit for being the largest maker and operator of robots in the world, largely because it uses them internally.

The same can be said about its chip segment. This is a $20 billion run-rate business, but it's closer to $50 billion when taking into account internal use. This use saves Amazon on capital expenditures and inference expenses.

The company has good momentum in its cloud computing business, Amazon Web Services (AWS), with large commitments and partnerships with Anthropic and OpenAI. AWS revenue growth has been accelerating and should continue to pick up through the rest of the year.

Overall, with leading e-commerce and cloud businesses, Amazon is a top stock to pick up on this pullback.

3. ServiceNow: An agentic AI winner

ServiceNow (NYSE: NOW) had started to recover from the sell-off in software-as-a-service (SaaS) stocks this spring, only to see its shares pushed back down in this latest tech dip. However, the company remains one of the most intriguing beaten-down SaaS stocks, looking very well positioned to be an AI beneficiary.

The company's strength lies in the fact that its platform is used by information technology departments to run their entire software stacks. Its configuration management database is entrenched in its customers' workflow and data, and it maps the structural relationships among hardware, software, cloud services, and business processes.

This makes it an irreplaceable system of record and is the foundation of its push into agentic AI orchestration. Its new AI Control Tower monitors every AI agent model running within a business, making sure they follow governance rules and are performing as advertised.

With agentic AI still in its early phases, this is an enormous opportunity, and ServiceNow looks like the company best positioned to become the leader in this space.

Should you buy stock in Broadcom right now?

Before you buy stock in Broadcom, consider this:

The Motley Fool Stock Advisor analyst team just identified what they believe are the 10 best stocks for investors to buy now… and Broadcom wasn’t one of them. The 10 stocks that made the cut could produce monster returns in the coming years.

Consider when Netflix made this list on December 17, 2004... if you invested $1,000 at the time of our recommendation, you’d have $415,040!* Or when Nvidia made this list on April 15, 2005... if you invested $1,000 at the time of our recommendation, you’d have $1,256,076!*

Now, it’s worth noting Stock Advisor’s total average return is 920% — a market-crushing outperformance compared to 207% for the S&P 500. Don't miss the latest top 10 list, available with Stock Advisor, and join an investing community built by individual investors for individual investors.

See the 10 stocks »

*Stock Advisor returns as of June 19, 2026.

Geoffrey Seiler has positions in Alphabet, Amazon, Broadcom, and ServiceNow. The Motley Fool has positions in and recommends Alphabet, Amazon, Broadcom, and ServiceNow. The Motley Fool has a disclosure policy.

The views and opinions expressed herein are the views and opinions of the author and do not necessarily reflect those of Nasdaq, Inc.",https://www.nasdaq.com/articles/3-ai-stocks-buy-recent-tech-dip,"['AMZN.US', 'AVGO.US', 'GOOGL.US', 'NOW.US']","['AI', 'CLOUD-COMPUTING', 'E-COMMERCE', 'MARKETS', 'REVENUE GROWTH', 'SAAS', 'TECH', 'TOTAL REVENUE']",0.999,0.022,0.823,0.154
