query_ticker,date,title,content,link,symbols,tags,sentiment.polarity,sentiment.neg,sentiment.neu,sentiment.pos
AVGO.US,2026-06-17T22:47:03+00:00,"Stock Market Today, June 17: Marvell Rises as AI Bookings Build on Nvidia-Linked Momentum","Marvell Technology(NASDAQ:MRVL), a data infrastructure semiconductor provider, closed at $289.54, up 3.90%. Premarket comments from Nvidia's CEO and a new $2 billion AI chip alliance lifted the stock, while investors are watching AI bookings and data-center demand next.

The company’s trading volume reached 48.6M shares, which is about 38% above its three-month average of 36.1M shares. Marvell Technology IPO'd in 2000 and has grown 1,932% since going public.

How the markets moved today

S&P 500(SNPINDEX:^GSPC) closed at 7,420.10, down 1.19%, while the Nasdaq Composite(NASDAQINDEX:^IXIC) finished at 26,021.66, down 1.34%. Among semiconductor and data infrastructure peers, Broadcom(NASDAQ:AVGO) closed at $392.90, up 4.30%, while Nvidia(NASDAQ:NVDA) closed at $204.65, down 1.33%, highlighting a mixed session across the sector.

What this means for investors

Marvell Technology shares rose despite broader market weakness, driven by momentum from the March NVLink Fusion partnership with Nvidia and Nvidia’s $2 billion investment. The upcoming addition to the S&P 500 is also expected to boost index-related demand and increase visibility among large-cap investors.

The key question now is whether Marvell’s AI demand is durable enough to support its higher outlook. Recent Q1 results showed record revenue, an improved Q2 outlook, and strong AI-related bookings in data-center infrastructure. The next test will be whether demand for custom XPUs, optical interconnects, and scale-up networking can turn Marvell’s AI bookings into sustained revenue and margin growth.

Should you buy stock in Marvell Technology right now?

Before you buy stock in Marvell Technology, consider this:

The Motley Fool Stock Advisor analyst team just identified what they believe are the 10 best stocks for investors to buy now… and Marvell Technology wasn’t one of them. The 10 stocks that made the cut could produce monster returns in the coming years.

Consider when Netflix made this list on December 17, 2004... if you invested $1,000 at the time of our recommendation, you’d have $424,531!* Or when Nvidia made this list on April 15, 2005... if you invested $1,000 at the time of our recommendation, you’d have $1,273,016!*

Now, it’s worth noting Stock Advisor’s total average return is 940% — a market-crushing outperformance compared to 209% for the S&P 500. Don't miss the latest top 10 list, available with Stock Advisor, and join an investing community built by individual investors for individual investors.

See the 10 stocks »

*Stock Advisor returns as of June 17, 2026.

Eric Trie has positions in Nvidia. The Motley Fool has positions in and recommends Broadcom, Marvell Technology, and Nvidia. The Motley Fool has a disclosure policy.

The views and opinions expressed herein are the views and opinions of the author and do not necessarily reflect those of Nasdaq, Inc.",https://www.nasdaq.com/articles/stock-market-today-june-17-marvell-rises-ai-bookings-build-nvidia-linked-momentum,"['AVGO.US', 'MRVL.US', 'NVDA.US']","['AI', 'DATA-CENTER', 'EARNINGS', 'MARKETS', 'SEMICONDUCTORS']",0.965,0.036,0.878,0.086
AVGO.US,2026-06-17T22:47:03+00:00,"Stock Market Today, June 17: Marvell Rises as AI Bookings Build on Nvidia-Linked Momentum","Marvell Technology (NASDAQ:MRVL), a data infrastructure semiconductor provider, closed at $289.54, up 3.90%. Premarket comments from Nvidia's CEO and a new $2 billion AI chip alliance lifted the stock, while investors are watching AI bookings and data-center demand next.

The company's trading volume reached 48.6M shares, which is about 38% above its three-month average of 36.1M shares. Marvell Technology IPO'd in 2000 and has grown 1,932% since going public.

How the markets moved today

S&P 500 (SNPINDEX:^GSPC) closed at 7,420.10, down 1.19%, while the Nasdaq Composite (NASDAQINDEX:^IXIC) finished at 26,021.66, down 1.34%. Among semiconductor and data infrastructure peers, Broadcom (NASDAQ:AVGO) closed at $392.90, up 4.30%, while Nvidia (NASDAQ:NVDA) closed at $204.65, down 1.33%, highlighting a mixed session across the sector.

What this means for investors

Marvell Technology shares rose despite broader market weakness, driven by momentum from the March NVLink Fusion partnership with Nvidia and Nvidia's $2 billion investment. The upcoming addition to the S&P 500 is also expected to boost index-related demand and increase visibility among large-cap investors.

The key question now is whether Marvell's AI demand is durable enough to support its higher outlook. Recent Q1 results showed record revenue, an improved Q2 outlook, and strong AI-related bookings in data-center infrastructure. The next test will be whether demand for custom XPUs, optical interconnects, and scale-up networking can turn Marvell's AI bookings into sustained revenue and margin growth.

Should you buy stock in Marvell Technology right now?

Before you buy stock in Marvell Technology, consider this:

The Motley Fool Stock Advisor analyst team just identified what they believe are the 10 best stocks for investors to buy now… and Marvell Technology wasn't one of them. The 10 stocks that made the cut are built for long-term growth and could produce monster returns in the coming years.

Consider when Netflix made this list on December 17, 2004... if you invested $1,000 at the time of our recommendation, you'd have $424,531!* Or when Nvidia made this list on April 15, 2005... if you invested $1,000 at the time of our recommendation, you'd have $1,273,016!*

That performance is why people listen. With a track record of beating the S&P 500 by 4x, Stock Advisor offers a distinct advantage. Don't miss the latest top 10 list, available with Stock Advisor, and join an investing community built for the long haul.

See the 10 stocks »

Story Continues

*Stock Advisor returns as of June 17, 2026.

Eric Trie has positions in Nvidia. The Motley Fool has positions in and recommends Broadcom, Marvell Technology, and Nvidia. The Motley Fool has a disclosure policy.

Stock Market Today, June 17: Marvell Rises as AI Bookings Build on Nvidia-Linked Momentum was originally published by The Motley Fool",https://finance.yahoo.com/markets/stocks/articles/stock-market-today-june-17-224703370.html,"['AVGO.US', 'IXIC.INDX', 'MRVL.US', 'NVDA.US']","['AI', 'DATA-CENTER', 'EARNINGS', 'SEMICONDUCTORS', 'SP500']",0.952,0.048,0.862,0.09
AVGO.US,2026-06-17T21:29:51+00:00,"Stock Market Today, June 17: Stocks Slide on Fed Rate Hike Fears","The S&P 500 (SNPINDEX:^GSPC) lost 1.21% to 7,420.10, the Nasdaq Composite (NASDAQINDEX:^IXIC) fell 1.34% to 26,021.66, and the Dow Jones Industrial Average (DJINDICES:^DJI) declined 0.98% to 51,492.55 as investors reacted to hawkish central bank signaling and tech sector pressure.

Gold prices fell 1.77% to $4,254.65, and the 10-Year Treasury yield rose 0.06% to 4.49% as of U.S. market close. All sectors fell, with communications services dropping 2.91% and consumer cylicals falling 2.34%.

Today's biggest moves

Shares of Meta Platforms slid today alongside other megacap tech stocks, including Microsoft and Amazon. Space Exploration Technologies snapped its post-IPO rally for the first time since its market debut.

Conversely, ASML Holding rose 4% on optimism about SpaceX's artificial intelligence (AI) spending, and Broadcom gained on bullish analyst guidance. Broader market volatility means investors are being selective within the semiconductor space.

What this means for investors

Stocks fell today as markets digested a more hawkish tone from the Federal Reserve, following the first meeting under new Chairman Kevin Warsh. The Fed held rates steady in a unanimous decision, but nine out of 18 members who submitted projections thought there'd be at least one rate hike this year. Six thought there'd be two or more.

Higher interest rates can pressure stock markets. Not only do consumers tend to spend less, but expansion is also harder when borrowing costs are elevated. Broadly speaking, a rate increase could reduce appetite for riskier sectors, such as tech and AI, while potentially boosting financial stocks. However, for long-term investors, getting inflation under control — something Warsh stressed his commitment to — is beneficial.

Should you buy stock in S&P 500 Index right now?

Before you buy stock in S&P 500 Index, consider this:

The Motley Fool Stock Advisor analyst team just identified what they believe are the 10 best stocks for investors to buy now… and S&P 500 Index wasn't one of them. The 10 stocks that made the cut are built for long-term growth and could produce monster returns in the coming years.

Consider when Netflix made this list on December 17, 2004... if you invested $1,000 at the time of our recommendation, you'd have $424,531!* Or when Nvidia made this list on April 15, 2005... if you invested $1,000 at the time of our recommendation, you'd have $1,273,016!*

That performance is why people listen. With a track record of beating the S&P 500 by 4x, Stock Advisor offers a distinct advantage. Don't miss the latest top 10 list, available with Stock Advisor, and join an investing community built for the long haul.

Story Continues

See the 10 stocks »

*Stock Advisor returns as of June 17, 2026.

Emma Newbery has positions in Amazon. The Motley Fool has positions in and recommends ASML, Accenture Plc, Amazon, Broadcom, Meta Platforms, Microsoft, and Netflix. The Motley Fool recommends the following options: long January 2028 $260 calls on Accenture Plc and short January 2028 $280 calls on Accenture Plc. The Motley Fool has a disclosure policy.

Stock Market Today, June 17: Stocks Slide on Fed Rate Hike Fears was originally published by The Motley Fool

View Comments",https://finance.yahoo.com/markets/stocks/articles/stock-market-today-june-17-212951273.html,"['AMZN.US', 'ASML.US', 'AVGO.US', 'DJI.INDX', 'GC.COMM', 'GSPC.INDX', 'META.US', 'MSFT.US', 'SPCX.US']","['FED', 'FINANCIALS', 'RATES', 'SEMICONDUCTORS', 'TECH']",0.832,0.076,0.824,0.1
AVGO.US,2026-06-17T20:35:47+00:00,Stocks Retreat as Fed Signals Possible Higher Interest Rates,"The S&P 500 Index ($SPX) (SPY) on Wednesday closed down -1.21%, the Dow Jones Industrial Average ($DOWI) (DIA) closed down -0.98%, and the Nasdaq 100 Index ($IUXX) (QQQ) closed down -0.99%.  June E-mini S&P futures (ESM26) fell -1.19%, and June E-mini Nasdaq futures (NQM26) fell -0.95%.

Stock indexes gave up early gains on Wednesday and settled sharply lower, with the Dow Jones Industrials falling from a new all-time high, after the Fed signaled the possibility of higher interest rates later this year.  As expected, the FOMC kept interest rates unchanged following Wednesday's meeting, but its dot-plot of interest rate projections indicates at least one more 25 bp rate hike this year.  The weakness in the Magnificent Seven technology stocks and a slump in software stocks weighed on the overall market.

More News from Barchart

Rocket Lab vs. Redwire: 1 Stock Has the Stronger Growth Story for the Next Decade Dear SpaceX Stock Fans, Mark Your Calendars for June 16 Dear Western Digital Stock Fans, Mark Your Calendars for June 22 Our exclusive Barchart Brief newsletter is your FREE midday guide to what's moving stocks, sectors, and investor sentiment - delivered right when you need the info most. Subscribe today!

Stocks initially moved higher on Wednesday amid strength in chipmakers. Stocks also garnered support on better-than-expected US economic reports on US May retail sales, a sign of resilient consumer demand, and May pending home sales.

Stocks also have carryover support from Monday after the US and Iran agreed to end their war and reopen the Strait of Hormuz, knocking crude oil prices down to a 3.5-month low and stoking risk-on sentiment in asset markets.

US MBA mortgage applications fell -3.8% in the week ended June 12, with the purchase mortgage sub-index down -3.4% and the refinancing mortgage sub-index down -4.5%.  The average 30-year fixed rate mortgage was unchanged from last week at 6.60%.

US May retail sales rose +0.9% m/m, stronger than expectations of +0.6% m/m.  Also, May retail sales ex-autos rose +0.8% m/m, stronger than expectations of +0.6% m/m.

US May pending home sales rose +3.8% m/m, stronger than expectations of +0.9% m/m and the biggest increase in 20 months.

The FOMC, as expected, voted unanimously to keep the fed funds rate target unchanged at 3.50%-3.75% and to remove language on potential additional interest rate adjustments, declaring ""the committee will deliver price stability.""

The FOMC's dot plot of interest rate projections showed the committee raised its fed funds rate projection to 3.750% at the end of 2026, up from a prior estimate of 3.375%, implying at least one more 25 bp rate hike this year.  Nine of 18 FOMC participants penciled in at least one more rate hike this year, with six anticipating at least two.

Story Continues

The Fed cut its US 2026 GDP projection to 2.2% from a March projection of 2.4% and boosted its 2026 core PCE projection to 3.3% from 2.7%.

Fed Chair Keven Warsh said he's appointing task forces to examine central bank functions, including communications, the balance sheet, reliance on existing data sources, productivity and jobs, and the Fed's inflation framework.

WTI crude oil prices (CLN26) recovered from a 3.5-month low today and rose nearly 1% as prices consolidated following this week's plunge.  The eventual resumption of vessel traffic through the Strait of Hormuz could lead to the release of more than 100 laden ships carrying oil from Middle Eastern countries other than Iran that are stuck in the Persian Gulf, effectively releasing stockpiles into the market.  Goldman Sachs on Tuesday cut its price forecast on Brent crude to $80 a barrel in Q4 of this year, down from $90 a barrel, and said it expects Persian Gulf crude exports to return to pre-war levels by the end of July, one month earlier than previously expected.

The markets are discounting a 36% chance of a +25 bp rate hike at the next FOMC meeting on July 28-29.

Overseas stock markets settled higher on Wednesday.  The Euro Stoxx 50 rallied to a new record high and closed up +0.68%.  China's Shanghai Composite rose to a 2.5-week high and closed up +0.40%.  Japan's Nikkei-225 Stock Average climbed to a new all-time high and closed up +0.72%.

Interest Rates

September 10-year T-notes (ZNU6) on Wednesday closed down -12 ticks, and the 10-year T-note yield rose +3.6 bp to 4.475%.  Sep T-notes moved lower on Wednesday after US economic reports showed May retail sales and May pending home sales rose more than expected, a hawkish factor for Fed policy.  T-notes extended their losses on Wednesday afternoon when the Fed raised its US 2026 core PCE estimate and projected higher interest rates later this year.

European government bond yields are moving lower today.  The 10-year German bund yield fell to a 1.75-month low of 2.914% and finished down -0.3 bp to 2.927%.  The 10-year UK gilt yield fell to a 2-month low of 4.734% and finished down -3.7 bp to 4.751%.

Eurozone May core CPI was revised upward to 2.6% y/y from the previously reported 2.5% y/y, the strongest pace of increase in 13 months.

ECB Governing Council member Gediminas Simkus said that the ""pass-through of the increase in energy and other raw material prices to the market has already occurred,"" and ""at least one more rate increase is certainly more likely than not.""

UK May CPI rose 2.8% y/y, weaker than expectations of 3.0% y/y. May core CPI rose 2.6% y/y, weaker than expectations of 2.7% y/y.

Swaps are discounting a 16% chance of a +25 bp ECB rate hike at its next policy meeting on July 23.

US Stock Movers

The Magnificent Seven technology stocks moved lower on Wednesday, weighing on the broader market.  Meta Platforms (META) is down more than -3% to lead losers in the Nasdaq 100, and Alphabet (GOOGL) and Amazon.com (AMZN) are down more than-2%.  Also, Microsoft (MSFT) and Tesla (TSLA) are down more than -1%.  In addition, Apple (AAPL) is down -0.64% and Nvidia (NVDA) is down -0.50%.

Software stocks retreated on Wednesday, a negative factor for the overall market.  Adobe Systems (ADBE) and ServiceNow (NOW) close down more than -5%, and Salesforce (CRM)

Closed down more than -4% to lead losers in the Dow Jones industrials.  Also, Atlassian Corp (TEAM), Autodesk (ADSK), and Intuit (INTU) closed down more than -4%, and Workday (WDAY) closed down more than -3%.  In addition, Oracle (ORCL) closed down more than -2%, and Datadog (DDOG) and Palantir Technologies (PLTR) closed down more than -1%.

Telecommunication stocks were under pressure on Wednesday, a negative factor for the overall market. Charter Communications (CHTR) closed down more than -6%, and Comcast Corp (CMCSA) closed down more than -3%.  Also, AT&T (T) closed down more than -2%, and T-Mobile US (TMUS) and Verizon Communications (VZ) closed down more than -1%.

Trucking stocks slid for a third day on Wednesday after Citigroup on Monday warned that the recent rally in trucking and logistics stocks had been overdone.  RXO Inc (RXO) and ArcBest (ARCB) closed down more than -8%, and Old Dominion Freight Line (ODFL), XPO Inc (XPO), and Knight-Swift Transportation Holdings (KNX) closed down more than -5%.  Also, CH Robinson Worldwide (CHRW) and FedEx Freight Holdings (FDXF) closed down more than -1%.

Chipmakers rebounded on Wednesday, recovering some of Tuesday's sharp losses.  ARM Holdings Plc (ARM) closed up more than +5% to lead gainers in the Nasdaq 100, and Applied Materials (AMAT) and Broadcom (AVGO) closed up more than +4%.  Also, ASML Holding NV (ASML), Marvell Technology (MRVL), and (INTC) closed up more than +3%, and Micron Technology (MU) closed up more than +2%.  In addition, Advanced Micro Devices (AMD) and Lam Research (LRCX) closed up more than +1%.

Ormat Technologies (ORA) closed down more than -5% after Bernstein initiated coverage on the stock with a recommendation of underperform and a price target of $115.

Rexford Industrial Realty (REXR) closed down more than -5% after JPMorgan Chase downgraded the stock to underweight from neutral with a price target of $25.

Leidos Holdings (LDOS) closed down more than -4% after Bank of America Global Research downgraded the stock to neutral from buy.

CME Group (CME) closed down more than -3% after announcing that CEO Terry Duffy is stepping down and CFO Lynne Fitzpatrick will replace him on March 1, 2027.

ResMed (RMD) closed down more than -3% after Morgan Stanley downgraded the stock to equal weight from overweight.

UniQure NV (QURE) closed up more than +79% after saying the FDA allowed 3-year data from its Phase I/II study of AMT-130 for Huntington's disease to be acceptable as the primary basis for an application for accelerated approval.

Wabash National Corp (WNC) closed up more than +16% after D.A. Davidson upgraded the stock to buy from neutral with a price target of $20.

La-Z-Boy (LZB) closed up more than +15% after reporting Q4 adjusted EPS of $1.26, stronger than the consensus of 83 cents.

Aehr Test Systems (AEHR) closed up more than +7% after saying it received a follow-on production order for a fully automated FOX-XP wafer-level burn-in (WLBI) system.

Credicorp Ltd (BAP) closed up more than +6% after Morgan Stanley upgraded the stock to overweight from equal weight with a price target of $480.

Figma Inc (FIG) closed up more than +4% after Citigroup initiated coverage on the stock with a recommendation of buy and a price target of $36.

Earnings Reports(6/18/2026)

Accenture PLC (ACN) and Kroger Co/The (KR).

On the date of publication, Rich Asplund did not have (either directly or indirectly) positions in any of the securities mentioned in this article. All information and data in this article is solely for informational purposes. This article was originally published on Barchart.com

View Comments",https://finance.yahoo.com/markets/stocks/articles/stocks-retreat-fed-signals-possible-203547154.html,"['AAPL.US', 'ACN.US', 'ADBE.US', 'ADSK.US', 'AEHR.US', 'AMAT.US', 'AMD.US', 'AMZN.US', 'ARCB.US', 'ARM.US', 'ASML.US', 'AVGO.US', 'BAP.US', 'CHRW.US', 'CHTR.US', 'CMCSA.US', 'CME.US', 'CRM.US', 'DDOG.US', 'DJI.INDX', 'FDXF.US', 'FIG.US', 'FOMC.US', 'GOOGL.US', 'GSPC.INDX', 'INTC.US', 'INTU.US', 'IXIC.INDX', 'KNX.US', 'LDOS.US', 'LRCX.US', 'LZB.US', 'META.US', 'MRVL.US', 'MSFT.US', 'NDX.INDX', 'NOW.US', 'NVDA.US', 'ODFL.US', 'ORA.US', 'ORCL.US', 'PLTR.US', 'QURE.US', 'REXR.US', 'RMD.US', 'RXO.US', 'SPY.US', 'T.US', 'TEAM.US', 'TMUS.US']","['BALANCE SHEET', 'CHIPMAKERS', 'DOWNGRADE', 'EARNINGS', 'FED', 'INTEREST-RATES', 'PRICE TARGET']",0.989,0.061,0.856,0.083
AVGO.US,2026-06-17T20:15:25+00:00,"Nasdaq, US stocks slide as Fed forecasts possible rate hike","US stocks (^DJI, ^IXIC, ^GSPC) ended Wednesday's session in negative territory after Federal Reserve officials unanimously voted to hold interest rates at their June FOMC meeting today, while also forecasting at least one possible rate hike ahead.

Yahoo Finance Markets and Data Editor Jared Blikre breaks down the trading day's market reactions to the Fed's big decision.

This was Kevin Warsh's first FOMC meeting he presided over as the new chairman of the Fed.

Video Transcript

00:00 Jared

Kevin Worsh's report card as told by the market. A little bit risk off here. We got the Dow down 500 points or about 1%.

00:06 Jared

Show you the intraday price action. This was the reaction off of the report uh when it dropped at 2:00 p.m. and then throughout the Fed uh throughout the Fed uh press conference and we don't know how many of those we're going to have left.

00:18 Jared

Uh it was just kind of down and to the right there. Very similar story in the Nasdaq and we can see a little bit worse than the Dow off one and a third percent. S&P 500 a little bit less than the Nasdaq.

00:27 Jared

And let's check in on small caps. Uh S&P 600 down uh 1.3% as well.

00:34 Jared

Uh let's check in on some of the other markets. It wasn't all red. Semiconductors managed to cling on to some gains of 1.38%.

00:41 Jared

And you can see the market was much higher earlier in the day. In fact, we had new highs off of that report, but they were not able to hold on to those gains. Magnificent 7 started out bad and then at the report actually drifted lower into the close here.

00:51 Jared

So mega caps continue the story of lagging the general market. They really haven't led for some while. Uh and this is a picture worth talking about.

01:00 Jared

All 11 sectors in the red along with the S&P 500. The worst off, communication services. That is a mega cap sector, so is consumer discretionary

01:08 Jared

and uh you can go consumer staples as well. All those down more than 2%.

01:13 Jared

And here is the Nasdaq picture. You can see some chip stocks adding some green to to uh the board, but Microsoft down 4%, Amazon down 3 and a half, Meta down 5%.

01:21 Jared

Software not looking that great. Here is that board. You can see a few green names, Crowdstrike up half a percent. Uh Synopsis up 3%, but for the most part, a lot of dark red there.

01:31 Jared

And then in semiconductor land, bit of a different picture. Broadcom up four, Applied materials similarly, arm up more than five and Intel up more than three.

01:42 Jared

And within the Dow, only a few green spots here. Financials have really been one of the best performing sectors this month. JP Morgan, Goldman Sachs in the green for about three quarters of a percent, Caterpillar up 1%.

01:52 Jared

Industrials have been doing really well recently, not so much today, but that does it for the green. IBM down 3%, Salesforce down 4%.

02:00 Jared

Those of course are that uh software trade. And then even the staples, which are a lot of times defensive, not doing that great. Walmart down two, J&J down half a percent.

02:09 Jared

I'll leave it on the transports because in Dow theory, uh you see, you want to see the industrials and the transports following each other. Well, transports leading to the downside.

02:18 Jared

Not sure what to make of this, but uh we got another day in the week to sort this out and on that note, I'm going to hand it back to you, Josh.

02:24 Josh

All right. Thank you, Jared.

View Comments",https://finance.yahoo.com/video/nasdaq-us-stocks-slide-as-fed-forecasts-possible-rate-hike-201525166.html,"['1AMZN.MI', '1FB.MI', '1INTC.MI', '1MSFT.MI', '1YD.DU', '1YD.F', '1YD.HA', '1YD.HM', '1YD.MU', '45C.F', 'AMAT.US', 'AMZ.F', 'AMZ.HM', 'AMZ.MU', 'AMZ1.F', 'AMZN.BA', 'AMZN.MX', 'AMZN.SN', 'AMZN.US', 'AMZO34.SA', 'AVGO.US', 'AVGO34.SA', 'CAT.F', 'CAT.MX', 'CAT.US', 'CAT1.DU', 'CAT1.F', 'CAT1.HM', 'CAT1.MU', 'CATP34.SA', 'CRM.US', 'CRWD.US', 'DJI.INDX', 'FB20.F', 'FB2A.F', 'FB2A.HM', 'FOMC.US', 'FOO.F', 'FOO0.F', 'GSPC.INDX', 'IBM.BA', 'IBM.DU', 'IBM.F', 'IBM.HA', 'IBM.HM', 'IBM.MU', 'IBM.MX', 'IBM.US', 'IBM0.F', 'IBMB34.SA']","['FED', 'FINANCIALS', 'INDUSTRIALS', 'RATES', 'SEMICONDUCTORS']",0.895,0.047,0.891,0.063
